B2: 2007-03-12 Cell Speed Challenge 2007 規定キテイ課題カダイ部門ブモン 予選ヨセン結果ケッカ | I2: 予選ヨセン通過ツウカ ２６チーム （登録トウロク ４４チーム）
AB3: 参考サンコウタイム
B4: Team | C4: 304 | D4: 306 | E4: 307 | F4: 308 | G4: 311 | H4: 312 | I4: 313 | J4: 315 | K4: 316 | L4: 318 | M4: 321 | N4: 322 | O4: 323 | P4: 325 | Q4: 326 | R4: 328 | S4: 331 | T4: 333 | U4: 334 | V4: 335 | W4: 337 | X4: 338 | Y4: 340 | Z4: 343 | AA4: 344 | AB4: 302
H5: spe.h | J5: spe.h | O5: spe.h | T5: spe.h | X5: spe.h
B6: 問題モンダイ１ | C6: 20 | D6: 0.60151500000000002 | E6: 10.330709000000001 | F6: 0.90468599999999999 | G6: 0.34960200000000002 | H6: 0.12875400000000001 | I6: 6.3685489999999998 | J6: 2.1081599999999998 | K6: 0.15813199999999999 | L6: 0.32497300000000001 | M6: 20 | N6: 5.7427080000000004 | O6: 3.6429019999999999 | P6: 4.6674439999999997 | Q6: 4.1453290000000003 | R6: 20 | S6: 0.46390300000000001 | T6: 1.442507 | U6: 1.1932910000000001 | V6: 0.26707999999999998 | W6: 20 | X6: 16.636202999999998 | Y6: 0.37367600000000001 | Z6: 7.530151 | AA6: 20 | AB6: 7.1148000000000003E-2
B7: 問題モンダイ１ | C7: 20 | D7: 0.60150300000000001 | E7: 10.332583 | F7: 0.90314399999999995 | G7: 0.34971000000000002 | H7: 0.12859499999999999 | I7: 6.3693239999999998 | J7: 2.1074389999999998 | K7: 0.15815399999999999 | L7: 0.32494800000000001 | M7: 20 | N7: 5.7426969999999997 | O7: 3.641178 | P7: 4.6663160000000001 | Q7: 4.1473250000000004 | R7: 20 | S7: 0.46395500000000001 | T7: 1.428558 | U7: 1.1985060000000001 | V7: 0.26710299999999998 | W7: 20 | X7: 16.63636 | Y7: 0.37371100000000002 | Z7: 7.5305080000000002 | AA7: 20 | AB7: 7.1121000000000004E-2
B8: 問題モンダイ１ | C8: 20 | D8: 0.60151900000000003 | E8: 10.331853000000001 | F8: 0.90479299999999996 | G8: 0.34997299999999998 | H8: 0.128744 | I8: 6.3688289999999999 | J8: 2.107901 | K8: 0.15831000000000001 | L8: 0.32490200000000002 | M8: 20 | N8: 5.7427599999999996 | O8: 3.639621 | P8: 4.6684609999999997 | Q8: 4.1483980000000003 | R8: 20 | S8: 0.46351700000000001 | T8: 1.4436089999999999 | U8: 1.1932130000000001 | V8: 0.26702999999999999 | W8: 20 | X8: 16.636703000000001 | Y8: 0.37351400000000001 | Z8: 7.5304650000000004 | AA8: 20 | AB8: 7.1092000000000002E-2
B9: 問題モンダイ１ | C9: 20 | D9: 0.60145099999999996 | E9: 10.331941 | F9: 0.90459900000000004 | G9: 0.3498 | H9: 0.12864500000000001 | I9: 6.3692219999999997 | J9: 2.1077819999999998 | K9: 0.15814900000000001 | L9: 0.32464900000000002 | M9: 20 | N9: 5.7427450000000002 | O9: 3.6411609999999999 | P9: 4.6667670000000001 | Q9: 4.1492529999999999 | R9: 20 | S9: 0.46374199999999999 | T9: 1.4403870000000001 | U9: 1.193098 | V9: 0.267119 | W9: 20 | X9: 16.636710999999998 | Y9: 0.37368800000000002 | Z9: 7.531371 | AA9: 20 | AB9: 7.1120000000000003E-2
B10: 問題モンダイ１ | C10: 20 | D10: 0.60157700000000003 | E10: 10.330238 | F10: 0.90328399999999998 | G10: 0.35014200000000001 | H10: 0.12864300000000001 | I10: 6.3692679999999999 | J10: 2.1076199999999998 | K10: 0.15812799999999999 | L10: 0.32513300000000001 | M10: 20 | N10: 5.7427270000000004 | O10: 3.6436320000000002 | P10: 4.672561 | Q10: 4.145219 | R10: 20 | S10: 0.46246399999999999 | T10: 1.4397800000000001 | U10: 1.193079 | V10: 0.2671 | W10: 20 | X10: 16.63617 | Y10: 0.37370700000000001 | Z10: 7.5339460000000003 | AA10: 20 | AB10: 7.1202000000000001E-2
B11: 問題モンダイ２ | C11: 6.9256999999999999E-2 | D11: 5.8528999999999998E-2 | E11: 1.0423830000000001 | F11: 7.5517000000000001E-2 | G11: 5.0492000000000002E-2 | H11: 1.5459000000000001E-2 | I11: 0.60399199999999997 | J11: 0.18698200000000001 | K11: 1.821E-2 | L11: 20 | M11: 0.44016499999999997 | N11: 20 | O11: 0.31955899999999998 | P11: 0.43389100000000003 | Q11: 0.36819600000000002 | R11: 0.44364500000000001 | S11: 4.7948999999999999E-2 | T11: 0.117567 | U11: 0.11983099999999999 | V11: 5.2553000000000002E-2 | W11: 0.11247799999999999 | X11: 1.861256 | Y11: 3.5326999999999997E-2 | Z11: 0.67403400000000002 | AA11: 20 | AB11: 2.4949999999999998E-3
B12: 問題モンダイ２ | C12: 6.9247000000000003E-2 | D12: 5.8597999999999997E-2 | E12: 1.042276 | F12: 7.5475E-2 | G12: 5.0494999999999998E-2 | H12: 1.5454000000000001E-2 | I12: 0.60426199999999997 | J12: 0.186973 | K12: 1.8197000000000001E-2 | L12: 20 | M12: 0.44019900000000001 | N12: 20 | O12: 0.31929999999999997 | P12: 0.43399900000000002 | Q12: 0.36819400000000002 | R12: 0.44373200000000002 | S12: 4.8098000000000002E-2 | T12: 0.128973 | U12: 0.119796 | V12: 3.9881E-2 | W12: 0.11246200000000001 | X12: 1.861378 | Y12: 3.5360000000000003E-2 | Z12: 0.67383199999999999 | AA12: 20 | AB12: 2.545E-3
B13: 問題モンダイ２ | C13: 6.9235000000000005E-2 | D13: 5.8534999999999997E-2 | E13: 1.042192 | F13: 7.5497999999999996E-2 | G13: 5.0437999999999997E-2 | H13: 1.5488999999999999E-2 | I13: 0.60407699999999998 | J13: 0.187052 | K13: 1.8162000000000001E-2 | L13: 20 | M13: 0.44020999999999999 | N13: 20 | O13: 0.31947300000000001 | P13: 0.43404300000000001 | Q13: 0.36789500000000003 | R13: 0.44378499999999999 | S13: 4.8127999999999997E-2 | T13: 0.127888 | U13: 0.119718 | V13: 3.9830999999999998E-2 | W13: 0.112527 | X13: 1.8612880000000001 | Y13: 3.5388999999999997E-2 | Z13: 0.67613299999999998 | AA13: 20 | AB13: 2.5409999999999999E-3
B14: 問題モンダイ２ | C14: 6.9233000000000003E-2 | D14: 5.8603000000000002E-2 | E14: 1.042416 | F14: 7.5526999999999997E-2 | G14: 5.0403999999999997E-2 | H14: 1.5458E-2 | I14: 0.60350300000000001 | J14: 0.18704999999999999 | K14: 1.8211999999999999E-2 | L14: 20 | M14: 0.44010100000000002 | N14: 20 | O14: 0.31953100000000001 | P14: 0.43399399999999999 | Q14: 0.367983 | R14: 0.443859 | S14: 4.8073999999999999E-2 | T14: 0.12837399999999999 | U14: 0.119849 | V14: 6.0765E-2 | W14: 0.112528 | X14: 1.861273 | Y14: 3.5373000000000002E-2 | Z14: 0.67386100000000004 | AA14: 20 | AB14: 2.5439999999999998E-3
B15: 問題モンダイ２ | C15: 6.9255999999999998E-2 | D15: 5.8556999999999998E-2 | E15: 1.0421609999999999 | F15: 7.5531000000000001E-2 | G15: 5.0384999999999999E-2 | H15: 1.5440000000000001E-2 | I15: 0.60379400000000005 | J15: 0.18698400000000001 | K15: 1.8297000000000001E-2 | L15: 20 | M15: 0.440243 | N15: 20 | O15: 0.31930999999999998 | P15: 0.50229000000000001 | Q15: 0.36811899999999997 | R15: 0.443745 | S15: 4.8043000000000002E-2 | T15: 0.117788 | U15: 0.119866 | V15: 5.2495E-2 | W15: 0.11238099999999999 | X15: 1.8612439999999999 | Y15: 3.5351E-2 | Z15: 0.67374299999999998 | AA15: 20 | AB15: 2.5349999999999999E-3
B16: 問題モンダイ３ | C16: 1.2021E-2 | D16: 1.1301E-2 | E16: 5.3610999999999999E-2 | F16: 6.2960000000000002E-2 | G16: 0.14676600000000001 | H16: 3.1843000000000003E-2 | I16: 0.23083500000000001 | J16: 4.4927000000000002E-2 | K16: 2.1337999999999999E-2 | L16: 1.4879E-2 | M16: 2.9002469999999998 | N16: 2.7591999999999998E-2 | O16: 6.6105999999999998E-2 | P16: 5.4898000000000002E-2 | Q16: 7.4300000000000005E-2 | R16: 0.119421 | S16: 3.0626E-2 | T16: 8.5125999999999993E-2 | U16: 6.9374000000000005E-2 | V16: 1.5184E-2 | W16: 5.8879000000000001E-2 | X16: 9.4520999999999994E-2 | Y16: 1.1259E-2 | Z16: 0.25320100000000001 | AA16: 0.35391800000000001 | AB16: 5.0036999999999998E-2
B17: 問題モンダイ３ | C17: 1.2008E-2 | D17: 1.1304E-2 | E17: 5.2722999999999999E-2 | F17: 6.2600000000000003E-2 | G17: 0.14685300000000001 | H17: 3.1849000000000002E-2 | I17: 0.23102500000000001 | J17: 4.4821E-2 | K17: 2.1344999999999999E-2 | L17: 1.4881999999999999E-2 | M17: 2.9008970000000001 | N17: 2.7598999999999999E-2 | O17: 6.6064999999999999E-2 | P17: 5.4954999999999997E-2 | Q17: 7.4184E-2 | R17: 0.119514 | S17: 3.0620999999999999E-2 | T17: 8.5116999999999998E-2 | U17: 6.9386000000000003E-2 | V17: 1.5258000000000001E-2 | W17: 5.8722000000000003E-2 | X17: 9.4395999999999994E-2 | Y17: 1.1198E-2 | Z17: 0.251106 | AA17: 0.35603800000000002 | AB17: 4.9945999999999997E-2
B18: 問題モンダイ３ | C18: 1.1939999999999999E-2 | D18: 1.1365E-2 | E18: 5.2880000000000003E-2 | F18: 6.2558000000000002E-2 | G18: 0.14692 | H18: 3.2079000000000003E-2 | I18: 0.23116200000000001 | J18: 4.5003000000000001E-2 | K18: 2.1388999999999998E-2 | L18: 1.4888999999999999E-2 | M18: 2.9015849999999999 | N18: 2.7584999999999998E-2 | O18: 6.6068000000000002E-2 | P18: 5.4903E-2 | Q18: 7.4309E-2 | R18: 0.11944299999999999 | S18: 3.0619E-2 | T18: 8.5153999999999994E-2 | U18: 6.9363999999999995E-2 | V18: 1.5154000000000001E-2 | W18: 5.8895999999999997E-2 | X18: 9.4463000000000005E-2 | Y18: 1.1252E-2 | Z18: 0.25341000000000002 | AA18: 0.35413899999999998 | AB18: 5.0007000000000003E-2
B19: 問題モンダイ３ | C19: 1.2015E-2 | D19: 1.1386E-2 | E19: 5.2874999999999998E-2 | F19: 6.2538999999999997E-2 | G19: 0.146901 | H19: 3.1829999999999997E-2 | I19: 0.231077 | J19: 4.4833999999999999E-2 | K19: 2.1382999999999999E-2 | L19: 1.4963000000000001E-2 | M19: 2.9021439999999998 | N19: 2.7584999999999998E-2 | O19: 6.6070000000000004E-2 | P19: 5.4961000000000003E-2 | Q19: 7.4313000000000004E-2 | R19: 0.119475 | S19: 3.0612E-2 | T19: 8.5120000000000001E-2 | U19: 6.9375999999999993E-2 | V19: 1.524E-2 | W19: 5.8781E-2 | X19: 9.4547999999999993E-2 | Y19: 1.1263E-2 | Z19: 0.25330399999999997 | AA19: 0.35378599999999999 | AB19: 4.9979000000000003E-2
B20: 問題モンダイ３ | C20: 1.2031999999999999E-2 | D20: 1.1277000000000001E-2 | E20: 5.3467000000000001E-2 | F20: 0.110693 | G20: 0.146727 | H20: 3.1821000000000002E-2 | I20: 0.23087199999999999 | J20: 4.4787E-2 | K20: 2.1418E-2 | L20: 1.4799E-2 | M20: 2.9023620000000001 | N20: 2.7651999999999999E-2 | O20: 6.6100000000000006E-2 | P20: 5.5079000000000003E-2 | Q20: 7.4223999999999998E-2 | R20: 0.119447 | S20: 3.0592999999999999E-2 | T20: 8.5113999999999995E-2 | U20: 6.9380999999999998E-2 | V20: 1.5198E-2 | W20: 5.8867000000000003E-2 | X20: 9.4280000000000003E-2 | Y20: 1.1198E-2 | Z20: 0.252722 | AA20: 0.35440199999999999 | AB20: 5.0047000000000001E-2
B21: 問題モンダイ４ | C21: 1.1956E-2 | D21: 1.1342E-2 | E21: 5.4384000000000002E-2 | F21: 6.2559000000000003E-2 | G21: 0.14821400000000001 | H21: 3.1546999999999999E-2 | I21: 0.41004000000000002 | J21: 4.7571000000000002E-2 | K21: 2.1066999999999999E-2 | L21: 1.4501999999999999E-2 | M21: 3.358946 | N21: 2.7067999999999998E-2 | O21: 6.8411E-2 | P21: 6.4047999999999994E-2 | Q21: 7.8763E-2 | R21: 0.19659299999999999 | S21: 3.0183999999999999E-2 | T21: 8.4587999999999997E-2 | U21: 6.6680000000000003E-2 | V21: 1.5594E-2 | W21: 5.8952999999999998E-2 | X21: 9.5175999999999997E-2 | Y21: 1.1048000000000001E-2 | Z21: 0.342775 | AA21: 0.40226800000000001 | AB21: 5.0790000000000002E-2
B22: 問題モンダイ４ | C22: 1.1905000000000001E-2 | D22: 1.1377999999999999E-2 | E22: 5.4271E-2 | F22: 6.2517000000000003E-2 | G22: 0.148227 | H22: 3.1531999999999998E-2 | I22: 0.41015299999999999 | J22: 4.7495999999999997E-2 | K22: 2.0990000000000002E-2 | L22: 1.4555E-2 | M22: 3.3585470000000002 | N22: 2.7071999999999999E-2 | O22: 6.8422999999999998E-2 | P22: 6.3741000000000006E-2 | Q22: 7.8788999999999998E-2 | R22: 0.19623599999999999 | S22: 3.0192E-2 | T22: 8.4668999999999994E-2 | U22: 6.6657999999999995E-2 | V22: 1.5859000000000002E-2 | W22: 5.8842999999999999E-2 | X22: 9.4973000000000002E-2 | Y22: 1.1006999999999999E-2 | Z22: 0.34437899999999999 | AA22: 0.40196100000000001 | AB22: 5.0753E-2
B23: 問題モンダイ４ | C23: 1.1898000000000001E-2 | D23: 1.1367E-2 | E23: 5.5062E-2 | F23: 6.2539999999999998E-2 | G23: 0.14830499999999999 | H23: 3.1566999999999998E-2 | I23: 0.40973500000000002 | J23: 4.7586000000000003E-2 | K23: 2.1011999999999999E-2 | L23: 1.4565E-2 | M23: 3.3587210000000001 | N23: 2.7068999999999999E-2 | O23: 6.8417000000000006E-2 | P23: 6.4055000000000001E-2 | Q23: 7.8747999999999999E-2 | R23: 0.19628699999999999 | S23: 3.0129E-2 | T23: 8.4581000000000003E-2 | U23: 6.6642000000000007E-2 | V23: 1.5626000000000001E-2 | W23: 5.8861999999999998E-2 | X23: 9.4872999999999999E-2 | Y23: 1.1027E-2 | Z23: 0.34348099999999998 | AA23: 0.40192699999999998 | AB23: 5.0781E-2
B24: 問題モンダイ４ | C24: 1.1877E-2 | D24: 1.1322E-2 | E24: 5.5357000000000003E-2 | F24: 6.2558000000000002E-2 | G24: 0.14844199999999999 | H24: 3.1615999999999998E-2 | I24: 0.409827 | J24: 4.7577000000000001E-2 | K24: 2.1063999999999999E-2 | L24: 1.4558E-2 | M24: 3.3601719999999999 | N24: 2.7064999999999999E-2 | O24: 6.8509E-2 | P24: 6.4139000000000002E-2 | Q24: 7.8849000000000002E-2 | R24: 0.196185 | S24: 3.0186000000000001E-2 | T24: 8.4586999999999996E-2 | U24: 6.6673999999999997E-2 | V24: 1.8565000000000002E-2 | W24: 5.8861999999999998E-2 | X24: 9.4994999999999996E-2 | Y24: 1.1015E-2 | Z24: 0.34412100000000001 | AA24: 0.40176400000000001 | AB24: 5.0721000000000002E-2
B25: 問題モンダイ４ | C25: 1.1941999999999999E-2 | D25: 1.1310000000000001E-2 | E25: 5.5726999999999999E-2 | F25: 6.2670000000000003E-2 | G25: 0.14821699999999999 | H25: 3.1588999999999999E-2 | I25: 0.410109 | J25: 4.7639000000000001E-2 | K25: 2.1191999999999999E-2 | L25: 1.4515999999999999E-2 | M25: 3.3620369999999999 | N25: 2.7064999999999999E-2 | O25: 6.8431000000000006E-2 | P25: 6.3924999999999996E-2 | Q25: 7.8825999999999993E-2 | R25: 0.19628100000000001 | S25: 3.0225999999999999E-2 | T25: 8.4581000000000003E-2 | U25: 6.6673999999999997E-2 | V25: 1.5474E-2 | W25: 6.0151000000000003E-2 | X25: 9.4975000000000004E-2 | Y25: 1.1023E-2 | Z25: 0.34374199999999999 | AA25: 0.40240399999999998 | AB25: 5.0753E-2
B26: 問題モンダイ５ | C26: 1.796E-2 | D26: 1.6499E-2 | E26: 0.10917399999999999 | F26: 6.6512000000000002E-2 | G26: 0.17227500000000001 | H26: 3.2100999999999998E-2 | I26: 0.31900499999999998 | J26: 20 | K26: 2.4004000000000001E-2 | L26: 1.8578999999999998E-2 | M26: 3.4170410000000002 | N26: 4.0673000000000001E-2 | O26: 9.0494000000000005E-2 | P26: 0.100913 | Q26: 0.104501 | R26: 0.189445 | S26: 3.8436999999999999E-2 | T26: 6.5646999999999997E-2 | U26: 9.2315999999999995E-2 | V26: 4.7204999999999997E-2 | W26: 0.108863 | X26: 0.233463 | Y26: 1.5547E-2 | Z26: 0.33362599999999998 | AA26: 0.42239100000000002 | AB26: 5.0761000000000001E-2
B27: 問題モンダイ５ | C27: 1.797E-2 | D27: 1.6386999999999999E-2 | E27: 0.109829 | F27: 6.6494999999999999E-2 | G27: 0.17219000000000001 | H27: 3.2197000000000003E-2 | I27: 0.31873299999999999 | J27: 20 | K27: 2.3997999999999998E-2 | L27: 1.8683999999999999E-2 | M27: 3.4171589999999998 | N27: 4.0665E-2 | O27: 9.0471999999999997E-2 | P27: 0.10088800000000001 | Q27: 0.104543 | R27: 0.18950500000000001 | S27: 3.7177000000000002E-2 | T27: 6.5707000000000002E-2 | U27: 9.2284000000000005E-2 | V27: 4.7126000000000001E-2 | W27: 0.10879999999999999 | X27: 0.23347599999999999 | Y27: 1.5573999999999999E-2 | Z27: 0.33367799999999997 | AA27: 0.422487 | AB27: 5.0777000000000003E-2
B28: 問題モンダイ５ | C28: 1.8003999999999999E-2 | D28: 1.9047999999999999E-2 | E28: 0.109001 | F28: 6.6567000000000001E-2 | G28: 0.17258299999999999 | H28: 3.2176999999999997E-2 | I28: 0.31879200000000002 | J28: 20 | K28: 2.4027E-2 | L28: 1.8636E-2 | M28: 3.4175170000000001 | N28: 4.0677999999999999E-2 | O28: 9.0468000000000007E-2 | P28: 0.10117 | Q28: 0.10452699999999999 | R28: 0.18948000000000001 | S28: 3.7198000000000002E-2 | T28: 7.4536000000000005E-2 | U28: 9.2317999999999997E-2 | V28: 4.7088999999999999E-2 | W28: 0.10878400000000001 | X28: 0.233678 | Y28: 1.5699999999999999E-2 | Z28: 0.333648 | AA28: 0.42238399999999998 | AB28: 5.0730999999999998E-2
B29: 問題モンダイ５ | C29: 1.7968000000000001E-2 | D29: 1.6476999999999999E-2 | E29: 0.10931100000000001 | F29: 6.6552E-2 | G29: 0.17255799999999999 | H29: 3.2132000000000001E-2 | I29: 0.318743 | J29: 20 | K29: 2.4098000000000001E-2 | L29: 1.8568999999999999E-2 | M29: 3.4173309999999999 | N29: 4.1591999999999997E-2 | O29: 9.0465000000000004E-2 | P29: 0.10109600000000001 | Q29: 0.104446 | R29: 0.18950600000000001 | S29: 3.7208999999999999E-2 | T29: 6.5640000000000004E-2 | U29: 9.2230000000000006E-2 | V29: 4.7181000000000001E-2 | W29: 0.10885 | X29: 0.233651 | Y29: 1.5594999999999999E-2 | Z29: 0.33343099999999998 | AA29: 0.42243000000000003 | AB29: 5.0866000000000001E-2
B30: 問題モンダイ５ | C30: 1.7968000000000001E-2 | D30: 1.6549000000000001E-2 | E30: 0.108935 | F30: 6.6591999999999998E-2 | G30: 0.17222499999999999 | H30: 3.2171999999999999E-2 | I30: 0.31866800000000001 | J30: 20 | K30: 2.4015000000000002E-2 | L30: 1.8609000000000001E-2 | M30: 3.4166880000000002 | N30: 4.0674000000000002E-2 | O30: 9.0491000000000002E-2 | P30: 0.10112500000000001 | Q30: 0.104533 | R30: 0.18948400000000001 | S30: 3.7184000000000002E-2 | T30: 6.5764000000000003E-2 | U30: 9.2242000000000005E-2 | V30: 3.4651000000000001E-2 | W30: 0.108789 | X30: 0.233686 | Y30: 1.5657999999999998E-2 | Z30: 0.333509 | AA30: 0.42252299999999998 | AB30: 5.0774E-2
B32: Average (msec)
B33: 問題モンダイ１ | C33: =AVERAGE(C6:C10) *1000 -> 20000 | D33: =AVERAGE(D6:D10) *1000 -> 601.51300000000003 | E33: =AVERAGE(E6:E10) *1000 -> 10331.464800000002 | F33: =AVERAGE(F6:F10) *1000 -> 904.10120000000006 | G33: =AVERAGE(G6:G10) *1000 -> 349.84539999999998 | H33: =AVERAGE(H6:H10) *1000 -> 128.67619999999999 | I33: =AVERAGE(I6:I10) *1000 -> 6369.0383999999995 | J33: =AVERAGE(J6:J10) *1000 -> 2107.7804000000001 | K33: =AVERAGE(K6:K10) *1000 -> 158.1746 | L33: =AVERAGE(L6:L10) *1000 -> 324.92099999999994 | M33: =AVERAGE(M6:M10) *1000 -> 20000 | N33: =AVERAGE(N6:N10) *1000 -> 5742.7273999999998 | O33: =AVERAGE(O6:O10) *1000 -> 3641.6988000000001 | P33: =AVERAGE(P6:P10) *1000 -> 4668.3098 | Q33: =AVERAGE(Q6:Q10) *1000 -> 4147.1048000000001 | R33: =AVERAGE(R6:R10) *1000 -> 20000 | S33: =AVERAGE(S6:S10) *1000 -> 463.51619999999991 | T33: =AVERAGE(T6:T10) *1000 -> 1438.9682000000003 | U33: =AVERAGE(U6:U10) *1000 -> 1194.2374 | V33: =AVERAGE(V6:V10) *1000 -> 267.08640000000003 | W33: =AVERAGE(W6:W10) *1000 -> 20000 | X33: =AVERAGE(X6:X10) *1000 -> 16636.429399999997 | Y33: =AVERAGE(Y6:Y10) *1000 -> 373.65919999999994 | Z33: =AVERAGE(Z6:Z10) *1000 -> 7531.2882000000009 | AA33: =AVERAGE(AA6:AA10) *1000 -> 20000 | AB33: =AVERAGE(AB6:AB10) *1000 -> 71.136600000000001
B34: 問題モンダイ２ | C34: =AVERAGE(C11:C15) *1000 -> 69.245599999999996 | D34: =AVERAGE(D11:D15) *1000 -> 58.564399999999999 | E34: =AVERAGE(E11:E15) *1000 -> 1042.2855999999999 | F34: =AVERAGE(F11:F15) *1000 -> 75.509600000000006 | G34: =AVERAGE(G11:G15) *1000 -> 50.442799999999998 | H34: =AVERAGE(H11:H15) *1000 -> 15.46 | I34: =AVERAGE(I11:I15) *1000 -> 603.92559999999992 | J34: =AVERAGE(J11:J15) *1000 -> 187.00820000000002 | K34: =AVERAGE(K11:K15) *1000 -> 18.215600000000006 | L34: =AVERAGE(L11:L15) *1000 -> 20000 | M34: =AVERAGE(M11:M15) *1000 -> 440.18360000000001 | N34: =AVERAGE(N11:N15) *1000 -> 20000 | O34: =AVERAGE(O11:O15) *1000 -> 319.43459999999999 | P34: =AVERAGE(P11:P15) *1000 -> 447.64340000000004 | Q34: =AVERAGE(Q11:Q15) *1000 -> 368.07740000000007 | R34: =AVERAGE(R11:R15) *1000 -> 443.75319999999999 | S34: =AVERAGE(S11:S15) *1000 -> 48.058399999999999 | T34: =AVERAGE(T11:T15) *1000 -> 124.11799999999999 | U34: =AVERAGE(U11:U15) *1000 -> 119.81199999999998 | V34: =AVERAGE(V11:V15) *1000 -> 49.104999999999997 | W34: =AVERAGE(W11:W15) *1000 -> 112.4752 | X34: =AVERAGE(X11:X15) *1000 -> 1861.2877999999998 | Y34: =AVERAGE(Y11:Y15) *1000 -> 35.36 | Z34: =AVERAGE(Z11:Z15) *1000 -> 674.3205999999999 | AA34: =AVERAGE(AA11:AA15) *1000 -> 20000 | AB34: =AVERAGE(AB11:AB15) *1000 -> 2.5319999999999996
B35: 問題モンダイ３ | C35: =AVERAGE(C16:C20) *1000 -> 12.0032 | D35: =AVERAGE(D16:D20) *1000 -> 11.326600000000001 | E35: =AVERAGE(E16:E20) *1000 -> 53.111200000000004 | F35: =AVERAGE(F16:F20) *1000 -> 72.27 | G35: =AVERAGE(G16:G20) *1000 -> 146.83340000000001 | H35: =AVERAGE(H16:H20) *1000 -> 31.884399999999999 | I35: =AVERAGE(I16:I20) *1000 -> 230.99419999999998 | J35: =AVERAGE(J16:J20) *1000 -> 44.874399999999994 | K35: =AVERAGE(K16:K20) *1000 -> 21.374600000000001 | L35: =AVERAGE(L16:L20) *1000 -> 14.882400000000001 | M35: =AVERAGE(M16:M20) *1000 -> 2901.4470000000001 | N35: =AVERAGE(N16:N20) *1000 -> 27.602599999999999 | O35: =AVERAGE(O16:O20) *1000 -> 66.081800000000001 | P35: =AVERAGE(P16:P20) *1000 -> 54.95920000000001 | Q35: =AVERAGE(Q16:Q20) *1000 -> 74.26600000000002 | R35: =AVERAGE(R16:R20) *1000 -> 119.46 | S35: =AVERAGE(S16:S20) *1000 -> 30.6142 | T35: =AVERAGE(T16:T20) *1000 -> 85.126199999999997 | U35: =AVERAGE(U16:U20) *1000 -> 69.376199999999997 | V35: =AVERAGE(V16:V20) *1000 -> 15.206800000000001 | W35: =AVERAGE(W16:W20) *1000 -> 58.829000000000001 | X35: =AVERAGE(X16:X20) *1000 -> 94.441600000000008 | Y35: =AVERAGE(Y16:Y20) *1000 -> 11.234 | Z35: =AVERAGE(Z16:Z20) *1000 -> 252.74859999999998 | AA35: =AVERAGE(AA16:AA20) *1000 -> 354.45659999999998 | AB35: =AVERAGE(AB16:AB20) *1000 -> 50.003199999999993
B36: 問題モンダイ４ | C36: =AVERAGE(C21:C25) *1000 -> 11.9156 | D36: =AVERAGE(D21:D25) *1000 -> 11.3438 | E36: =AVERAGE(E21:E25) *1000 -> 54.960199999999993 | F36: =AVERAGE(F21:F25) *1000 -> 62.56880000000001 | G36: =AVERAGE(G21:G25) *1000 -> 148.28099999999998 | H36: =AVERAGE(H21:H25) *1000 -> 31.5702 | I36: =AVERAGE(I21:I25) *1000 -> 409.97279999999995 | J36: =AVERAGE(J21:J25) *1000 -> 47.573799999999999 | K36: =AVERAGE(K21:K25) *1000 -> 21.065000000000001 | L36: =AVERAGE(L21:L25) *1000 -> 14.539199999999999 | M36: =AVERAGE(M21:M25) *1000 -> 3359.6846 | N36: =AVERAGE(N21:N25) *1000 -> 27.067799999999995 | O36: =AVERAGE(O21:O25) *1000 -> 68.438200000000009 | P36: =AVERAGE(P21:P25) *1000 -> 63.9816 | Q36: =AVERAGE(Q21:Q25) *1000 -> 78.795000000000002 | R36: =AVERAGE(R21:R25) *1000 -> 196.31640000000002 | S36: =AVERAGE(S21:S25) *1000 -> 30.183399999999999 | T36: =AVERAGE(T21:T25) *1000 -> 84.601200000000006 | U36: =AVERAGE(U21:U25) *1000 -> 66.665600000000012 | V36: =AVERAGE(V21:V25) *1000 -> 16.223600000000001 | W36: =AVERAGE(W21:W25) *1000 -> 59.134199999999993 | X36: =AVERAGE(X21:X25) *1000 -> 94.998400000000004 | Y36: =AVERAGE(Y21:Y25) *1000 -> 11.023999999999999 | Z36: =AVERAGE(Z21:Z25) *1000 -> 343.69959999999998 | AA36: =AVERAGE(AA21:AA25) *1000 -> 402.06479999999993 | AB36: =AVERAGE(AB21:AB25) *1000 -> 50.759599999999992
B37: 問題モンダイ５ | C37: =AVERAGE(C26:C30) *1000 -> 17.974 | D37: =AVERAGE(D26:D30) *1000 -> 16.992000000000001 | E37: =AVERAGE(E26:E30) *1000 -> 109.25 | F37: =AVERAGE(F26:F30) *1000 -> 66.543599999999998 | G37: =AVERAGE(G26:G30) *1000 -> 172.36619999999996 | H37: =AVERAGE(H26:H30) *1000 -> 32.155799999999999 | I37: =AVERAGE(I26:I30) *1000 -> 318.78819999999996 | J37: =AVERAGE(J26:J30) *1000 -> 20000 | K37: =AVERAGE(K26:K30) *1000 -> 24.028400000000005 | L37: =AVERAGE(L26:L30) *1000 -> 18.615399999999998 | M37: =AVERAGE(M26:M30) *1000 -> 3417.1471999999999 | N37: =AVERAGE(N26:N30) *1000 -> 40.856399999999994 | O37: =AVERAGE(O26:O30) *1000 -> 90.478000000000009 | P37: =AVERAGE(P26:P30) *1000 -> 101.0384 | Q37: =AVERAGE(Q26:Q30) *1000 -> 104.51 | R37: =AVERAGE(R26:R30) *1000 -> 189.48399999999998 | S37: =AVERAGE(S26:S30) *1000 -> 37.440999999999995 | T37: =AVERAGE(T26:T30) *1000 -> 67.458800000000011 | U37: =AVERAGE(U26:U30) *1000 -> 92.278000000000006 | V37: =AVERAGE(V26:V30) *1000 -> 44.650399999999998 | W37: =AVERAGE(W26:W30) *1000 -> 108.81719999999999 | X37: =AVERAGE(X26:X30) *1000 -> 233.59080000000003 | Y37: =AVERAGE(Y26:Y30) *1000 -> 15.614800000000002 | Z37: =AVERAGE(Z26:Z30) *1000 -> 333.57839999999999 | AA37: =AVERAGE(AA26:AA30) *1000 -> 422.44300000000004 | AB37: =AVERAGE(AB26:AB30) *1000 -> 50.781800000000004
B38: Point | C38: 9 | D38: 16 | G38: 1 | H38: 12 | K38: 9 | L38: 8 | S38: 2 | V38: 7 | Y38: 21
B40: ソーティング済スみ Average(msec)
B41: 問題モンダイ１ | C41: 128.67619999999999 | D41: 158.1746 | E41: 267.08640000000003 | F41: 324.92099999999994 | G41: 349.84539999999998 | H41: 373.65919999999994 | I41: 463.51619999999991 | J41: 601.51300000000003 | K41: 904.10120000000006 | L41: 1194.2374 | M41: 1438.9682000000003 | N41: 2107.7804000000001 | O41: 3641.6988000000001 | P41: 4147.1048000000001 | Q41: 4668.3098 | R41: 5742.7273999999998 | S41: 6369.0383999999995 | T41: 7531.2882000000009 | U41: 10331.464800000002 | V41: 16636.429399999997 | W41: 20000 | X41: 20000 | Y41: 20000 | Z41: 20000 | AA41: 20000
B42: 問題モンダイ２ | C42: 15.46 | D42: 18.215600000000006 | E42: 35.36 | F42: 48.058399999999999 | G42: 49.104999999999997 | H42: 50.442799999999998 | I42: 58.564399999999999 | J42: 69.245599999999996 | K42: 75.509600000000006 | L42: 112.4752 | M42: 119.81199999999998 | N42: 124.11799999999999 | O42: 187.00820000000002 | P42: 319.43459999999999 | Q42: 368.07740000000007 | R42: 440.18360000000001 | S42: 443.75319999999999 | T42: 447.64340000000004 | U42: 603.92559999999992 | V42: 674.3205999999999 | W42: 1042.2855999999999 | X42: 1861.2877999999998 | Y42: 20000 | Z42: 20000 | AA42: 20000
B43: 問題モンダイ３ | C43: 11.234 | D43: 11.326600000000001 | E43: 12.0032 | F43: 14.882400000000001 | G43: 15.206800000000001 | H43: 21.374600000000001 | I43: 27.602599999999999 | J43: 30.6142 | K43: 31.884399999999999 | L43: 44.874399999999994 | M43: 53.111200000000004 | N43: 54.95920000000001 | O43: 58.829000000000001 | P43: 66.081800000000001 | Q43: 69.376199999999997 | R43: 72.27 | S43: 74.26600000000002 | T43: 85.126199999999997 | U43: 94.441600000000008 | V43: 119.46 | W43: 146.83340000000001 | X43: 230.99419999999998 | Y43: 252.74859999999998 | Z43: 354.45659999999998 | AA43: 2901.4470000000001
B44: 問題モンダイ４ | C44: 11.023999999999999 | D44: 11.3438 | E44: 11.9156 | F44: 14.539199999999999 | G44: 16.223600000000001 | H44: 21.065000000000001 | I44: 27.067799999999995 | J44: 30.183399999999999 | K44: 31.5702 | L44: 47.573799999999999 | M44: 54.960199999999993 | N44: 59.134199999999993 | O44: 62.56880000000001 | P44: 63.9816 | Q44: 66.665600000000012 | R44: 68.438200000000009 | S44: 78.795000000000002 | T44: 84.601200000000006 | U44: 94.998400000000004 | V44: 148.28099999999998 | W44: 196.31640000000002 | X44: 343.69959999999998 | Y44: 402.06479999999993 | Z44: 409.97279999999995 | AA44: 3359.6846
B45: 問題モンダイ５ | C45: 15.614800000000002 | D45: 16.992000000000001 | E45: 17.974 | F45: 18.615399999999998 | G45: 24.028400000000005 | H45: 32.155799999999999 | I45: 37.440999999999995 | J45: 40.856399999999994 | K45: 44.650399999999998 | L45: 66.543599999999998 | M45: 67.458800000000011 | N45: 90.478000000000009 | O45: 92.278000000000006 | P45: 101.0384 | Q45: 104.51 | R45: 108.81719999999999 | S45: 109.25 | T45: 172.36619999999996 | U45: 189.48399999999998 | V45: 233.59080000000003 | W45: 318.78819999999996 | X45: 333.57839999999999 | Y45: 422.44300000000004 | Z45: 3417.1471999999999 | AA45: 20000
B46: Point | C46: 6 | D46: 4 | E46: 3 | F46: 2 | G46: 1
D48: =D41-C41 -> 29.498400000000004 | E48: =E41-D41 -> 108.91180000000003 | F48: =F41-E41 -> 57.834599999999909 | G48: =G41-F41 -> 24.924400000000048 | H48: 0.5msec 以内イナイは同着ドウチャクとした． | W48: 灰色ハイイロの部分ブブンは不正解フセイカイ
D49: =D42-C42 -> 2.7556000000000047 | E49: =E42-D42 -> 17.144399999999994 | F49: =F42-E42 -> 12.698399999999999 | G49: =G42-F42 -> 1.046599999999998 | H49: 上位ジョウイとの時間ジカンの差サ
D50: =D43-C43 -> 9.2600000000000904E-2 | E50: =E43-D43 -> 0.67659999999999876 | F50: =F43-E43 -> 2.8792000000000009 | G50: =G43-F43 -> 0.32440000000000069
D51: =D44-C44 -> 0.31980000000000075 | E51: =E44-D44 -> 0.57179999999999964 | F51: =F44-E44 -> 2.6235999999999997 | G51: =G44-F44 -> 1.6844000000000019
D52: =D45-C45 -> 1.3771999999999984 | E52: =E45-D45 -> 0.98199999999999932 | F52: =F45-E45 -> 0.64139999999999731 | G52: =G45-F45 -> 5.4130000000000074
B54: 上位ジョウイのチーム番号バンゴウ
B55: 問題モンダイ１ | C55: 312 | D55: 316 | E55: 335 | F55: 318 | G55: 311
B56: 問題モンダイ２ | C56: 312 | D56: 316 | E56: 340 | F56: 331 | G56: 335
B57: 問題モンダイ３ | C57: 340 | D57: 306 | E57: 304 | F57: 318 | G57: 335
B58: 問題モンダイ４ | C58: 340 | D58: 306 | E58: 304 | F58: 318 | G58: 335
B59: 問題モンダイ５ | C59: 340 | D59: 306 | E59: 304 | F59: 318 | G59: 316