B2: 2007-04-23 Cell Speed Challenge 2007 決勝ケッショウラウンド結果ケッカ | J2: 予選ヨセン通過ツウカ ２６チーム （登録トウロク ４４チーム） | N2: 決勝ケッショウラウンド 提出テイシュツ ２５チーム
B4: Team | C4: 340 | D4: 306 | E4: 312 | F4: 304 | G4: 318 | H4: 335 | I4: 331 | J4: 311 | K4: 302 | L4: 307 | M4: 308 | N4: 313 | O4: 315 | P4: 321 | Q4: 322 | R4: 323 | S4: 325 | T4: 326 | U4: 328 | V4: 333 | W4: 334 | X4: 337 | Y4: 338 | Z4: 343 | AA4: 344
B5: 予選ヨセンPT | C5: 21 | D5: 16 | E5: 12 | F5: 9 | G5: 8 | H5: 7 | I5: 2 | J5: 1 | K5: 0 | L5: 0 | M5: 0 | N5: 0 | O5: 0 | P5: 0 | Q5: 0 | R5: 0 | S5: 0 | T5: 0 | U5: 0 | V5: 0 | W5: 0 | X5: 0 | Y5: 0 | Z5: 0 | AA5: 0
K6: 予選ヨセン0点テン
B7: 問題モンダイ１ | C7: 0.70995900000000001 | D7: 0.48923699999999998 | E7: 0.38223400000000002 | F7: 1.8127279999999999 | G7: 15 | H7: 0.37343999999999999 | I7: 1.085928 | J7: 1.0904419999999999 | K7: 0.39607599999999998 | L7: 1.0572349999999999 | M7: 3.0871960000000001 | N7: 15 | O7: 6.8092319999999997 | P7: 15 | Q7: 15 | R7: 15 | S7: 15 | T7: 15 | U7: 15 | V7: 15 | W7: 3.0986259999999999 | X7: 4.3950940000000003 | Y7: 15 | Z7: 15 | AA7: 15
C8: 0.708924 | D8: 0.489124 | E8: 0.38173899999999999 | F8: 1.8126739999999999 | H8: 0.373527 | I8: 1.085961 | J8: 1.0904609999999999 | K8: 0.396152 | L8: 1.0568949999999999 | M8: 3.0869520000000001 | O8: 6.8089599999999999 | W8: 3.0978340000000002 | X8: 4.3934730000000002
C9: 0.70927399999999996 | D9: 0.48910100000000001 | E9: 0.38220300000000001 | F9: 1.8125549999999999 | G9: Error | H9: 0.37367600000000001 | I9: 1.086103 | J9: 1.08962 | K9: 0.396092 | L9: 1.058128 | M9: 3.086983 | N9: Error | O9: 6.8087609999999996 | P9: Error | Q9: Error | R9: Error | S9: Error | T9: Error | U9: Error | V9: Error | W9: 3.1016270000000001 | X9: 4.3950040000000001 | Y9: Error | Z9: Error | AA9: Error
C10: 0.709731 | D10: 0.48909900000000001 | E10: 0.382216 | F10: 1.8125690000000001 | H10: 0.373448 | I10: 1.0855969999999999 | J10: 1.0900609999999999 | K10: 0.39614199999999999 | L10: 1.057005 | M10: 3.0868370000000001 | O10: 6.809609 | W10: 3.0980639999999999 | X10: 4.3949449999999999
C11: 0.70899100000000004 | D11: 0.48908600000000002 | E11: 0.38192199999999998 | F11: 1.8125249999999999 | H11: 0.373307 | I11: 1.0859890000000001 | J11: 1.0905100000000001 | K11: 0.396148 | L11: 1.0566880000000001 | M11: 3.0871520000000001 | O11: 6.8091340000000002 | W11: 3.0989550000000001 | X11: 4.3946440000000004
B12: 問題モンダイ２ | C12: 0.324901 | D12: 0.22537599999999999 | E12: 0.21276400000000001 | F12: 0.782165 | G12: 15 | H12: 0.17483599999999999 | I12: 15 | J12: 0.71432200000000001 | K12: 0.192103 | L12: 0.237347 | M12: 1.335887 | N12: 15 | O12: 2.9391319999999999 | P12: 6.8208270000000004 | Q12: 15 | R12: 5.5649360000000003 | S12: 5.401885 | T12: 5.5190380000000001 | U12: 6.7812039999999998 | V12: 2.3255720000000002 | W12: 1.70119 | X12: 1.8699330000000001 | Y12: 7.3614810000000004 | Z12: 15 | AA12: 15
C13: 0.32476100000000002 | D13: 0.225776 | E13: 0.21388299999999999 | F13: 0.78203900000000004 | H13: 0.17460600000000001 | J13: 0.71404699999999999 | K13: 0.19196099999999999 | L13: 0.238256 | M13: 1.3359859999999999 | O13: 2.9398469999999999 | P13: 6.8128330000000004 | R13: 5.5613640000000002 | S13: 5.40381 | T13: 5.5166839999999997 | U13: 6.7820619999999998 | V13: 2.3126310000000001 | W13: 1.7014499999999999 | X13: 1.86938 | Y13: 7.3610540000000002
C14: 0.32447700000000002 | D14: 0.22544500000000001 | E14: 0.21274199999999999 | F14: 0.78203100000000003 | G14: Error | H14: 0.17454900000000001 | I14: Error | J14: 0.71445400000000003 | K14: 0.191966 | L14: 0.237756 | M14: 1.335847 | N14: Error | O14: 2.9391699999999998 | P14: 6.819642 | Q14: Error | R14: 5.564597 | S14: 5.4015700000000004 | T14: 5.5163060000000002 | U14: 6.7970090000000001 | V14: 2.0511620000000002 | W14: 1.7017169999999999 | X14: 1.869831 | Y14: 7.3623099999999999 | Z14: Error | AA14: Error
C15: 0.32445299999999999 | D15: 0.22551199999999999 | E15: 0.212921 | F15: 0.78214600000000001 | H15: 0.17461199999999999 | J15: 0.71369899999999997 | K15: 0.19206200000000001 | L15: 0.236176 | M15: 1.3362050000000001 | O15: 2.9401030000000001 | P15: 6.8134649999999999 | R15: 5.5614920000000003 | S15: 5.4017650000000001 | T15: 5.5164309999999999 | U15: 6.7815269999999996 | V15: 2.383432 | W15: 1.701565 | X15: 1.8699950000000001 | Y15: 7.361205
C16: 0.32437899999999997 | D16: 0.225412 | E16: 0.21301999999999999 | F16: 0.78195400000000004 | H16: 0.17485000000000001 | J16: 0.71392500000000003 | K16: 0.19204199999999999 | L16: 0.237344 | M16: 1.335963 | O16: 2.9390869999999998 | P16: 6.8131060000000003 | R16: 5.5652150000000002 | S16: 5.4047929999999997 | T16: 5.5164010000000001 | U16: 6.7822190000000004 | V16: 1.987417 | W16: 1.701271 | X16: 1.8694580000000001 | Y16: 7.3619450000000004
B17: 問題モンダイ３ | C17: 2.1314E-2 | D17: 2.2412999999999999E-2 | E17: 2.1700000000000001E-2 | F17: 2.3730999999999999E-2 | G17: 4.2807999999999999E-2 | H17: 2.3432999999999999E-2 | I17: 15 | J17: 0.29298099999999999 | K17: 5.6779999999999997E-2 | L17: 5.6388000000000001E-2 | M17: 0.241588 | N17: 0.62471100000000002 | O17: 0.12453500000000001 | P17: 7.7493309999999997 | Q17: 15 | R17: 0.25072499999999998 | S17: 0.14204600000000001 | T17: 0.194464 | U17: 0.32327299999999998 | V17: 0.19525100000000001 | W17: 6.2225999999999997E-2 | X17: 0.17618500000000001 | Y17: 0.17627499999999999 | Z17: 0.66536799999999996 | AA17: 15
C18: 2.1309999999999999E-2 | D18: 2.2491000000000001E-2 | E18: 2.1798000000000001E-2 | F18: 2.3741000000000002E-2 | G18: 4.2553000000000001E-2 | H18: 2.3441E-2 | J18: 0.29294500000000001 | K18: 5.6619000000000003E-2 | L18: 5.6311E-2 | M18: 0.24152399999999999 | N18: 0.62484099999999998 | O18: 0.124954 | P18: 7.7455249999999998 | R18: 0.251114 | S18: 0.141989 | T18: 0.194471 | U18: 0.32325399999999999 | V18: 0.19514799999999999 | W18: 6.2231000000000002E-2 | X18: 0.17646500000000001 | Y18: 0.176257 | Z18: 0.66688599999999998
C19: 2.1190000000000001E-2 | D19: 2.2461999999999999E-2 | E19: 2.1696E-2 | F19: 2.3777E-2 | G19: 3.0054000000000001E-2 | H19: 2.3296999999999998E-2 | I19: Error | J19: 0.29273500000000002 | K19: 5.6667000000000002E-2 | L19: 5.6445000000000002E-2 | M19: 0.24157200000000001 | N19: 0.62429599999999996 | O19: 0.125027 | P19: 7.7467800000000002 | Q19: Error | R19: 0.25086700000000001 | S19: 0.141984 | T19: 0.19455900000000001 | U19: 0.32316099999999998 | V19: 0.195188 | W19: 6.2369000000000001E-2 | X19: 0.176289 | Y19: 0.176207 | Z19: 0.67573399999999995 | AA19: Error
C20: 2.1326999999999999E-2 | D20: 2.2449E-2 | E20: 2.1793E-2 | F20: 2.3737000000000001E-2 | G20: 4.2979000000000003E-2 | H20: 2.3408999999999999E-2 | J20: 0.29286699999999999 | K20: 5.6661999999999997E-2 | L20: 5.6614999999999999E-2 | M20: 0.24157200000000001 | N20: 0.62470800000000004 | O20: 0.12511700000000001 | P20: 7.744243 | R20: 0.250971 | S20: 0.14205999999999999 | T20: 0.19450200000000001 | U20: 0.32319900000000001 | V20: 0.195412 | W20: 6.2275999999999998E-2 | X20: 0.176258 | Y20: 0.17625399999999999 | Z20: 0.66975399999999996
C21: 2.1243999999999999E-2 | D21: 2.2483E-2 | E21: 2.1683999999999998E-2 | F21: 2.3743E-2 | G21: 4.2695999999999998E-2 | H21: 2.3359000000000001E-2 | J21: 0.292742 | K21: 5.6711999999999999E-2 | L21: 5.6321000000000003E-2 | M21: 0.241565 | N21: 0.62385599999999997 | O21: 0.125001 | P21: 7.7477850000000004 | R21: 0.25089499999999998 | S21: 0.141962 | T21: 0.19444800000000001 | U21: 0.32306000000000001 | V21: 0.19527 | W21: 6.225E-2 | X21: 0.176394 | Y21: 0.17622399999999999 | Z21: 0.67239199999999999
B22: 問題モンダイ４ | C22: 2.0632999999999999E-2 | D22: 2.1822999999999999E-2 | E22: 2.0693E-2 | F22: 2.2346000000000001E-2 | G22: 2.7193999999999999E-2 | H22: 2.3064999999999999E-2 | I22: 7.9170000000000004E-2 | J22: 0.32008399999999998 | K22: 5.5572999999999997E-2 | L22: 15 | M22: 15 | N22: 0.57355199999999995 | O22: 15 | P22: 15 | Q22: 15 | R22: 0.228267 | S22: 0.11767900000000001 | T22: 0.18259800000000001 | U22: 0.46806500000000001 | V22: 15 | W22: 6.0201999999999999E-2 | X22: 0.231318 | Y22: 0.139378 | Z22: 0.61994199999999999 | AA22: 15
C23: 2.0598999999999999E-2 | D23: 2.1787999999999998E-2 | E23: 2.0742E-2 | F23: 2.2297999999999998E-2 | G23: 2.7778000000000001E-2 | H23: 2.3035E-2 | I23: 7.4289999999999995E-2 | J23: 0.32 | K23: 5.5600999999999998E-2 | N23: 0.57356200000000002 | R23: 0.22910700000000001 | S23: 0.11762599999999999 | T23: 0.182619 | U23: 0.46797499999999997 | W23: 6.0308E-2 | X23: 0.23182700000000001 | Y23: 0.13911499999999999 | Z23: 0.61846400000000001
C24: 2.0604999999999998E-2 | D24: 2.1885999999999999E-2 | E24: 2.0865000000000002E-2 | F24: 2.2332999999999999E-2 | G24: 2.7623999999999999E-2 | H24: 2.3033999999999999E-2 | I24: 7.4380000000000002E-2 | J24: 0.32008700000000001 | K24: 5.5570000000000001E-2 | L24: Error | M24: Error | N24: 0.57312700000000005 | O24: Error | P24: Error | Q24: Error | R24: 0.22790099999999999 | S24: 0.117592 | T24: 0.18263299999999999 | U24: 0.46805099999999999 | V24: Error | W24: 6.0263999999999998E-2 | X24: 0.23137199999999999 | Y24: 0.140626 | Z24: 0.61146699999999998 | AA24: Error
C25: 2.0641E-2 | D25: 2.1762E-2 | E25: 2.0761000000000002E-2 | F25: 2.2350999999999999E-2 | G25: 2.8011999999999999E-2 | H25: 2.3050000000000001E-2 | I25: 7.4289999999999995E-2 | J25: 0.32011899999999999 | K25: 5.5530999999999997E-2 | N25: 0.57365699999999997 | R25: 0.22831199999999999 | S25: 0.117578 | T25: 0.18254200000000001 | U25: 0.468057 | W25: 6.0310000000000002E-2 | X25: 0.23130999999999999 | Y25: 0.13991100000000001 | Z25: 0.61664600000000003
C26: 2.0673E-2 | D26: 2.1763999999999999E-2 | E26: 2.0759E-2 | F26: 2.2398000000000001E-2 | G26: 2.7635E-2 | H26: 2.3033999999999999E-2 | I26: 7.4327000000000004E-2 | J26: 0.31970399999999999 | K26: 5.5597000000000001E-2 | N26: 0.57368399999999997 | R26: 0.22835900000000001 | S26: 0.117687 | T26: 0.18269199999999999 | U26: 0.46800700000000001 | W26: 6.0254000000000002E-2 | X26: 0.23148099999999999 | Y26: 0.139621 | Z26: 0.61038000000000003
B27: 問題モンダイ５ | C27: 3.3309999999999999E-2 | D27: 3.2849999999999997E-2 | E27: 0.10781300000000001 | F27: 4.5661E-2 | G27: 5.6217999999999997E-2 | H27: 15 | I27: 0.111912 | J27: 0.41831600000000002 | K27: 7.1568999999999994E-2 | L27: 8.8986999999999997E-2 | M27: 0.387658 | N27: 1.032341 | O27: 0.23885300000000001 | P27: 15 | Q27: 15 | R27: 15 | S27: 15 | T27: 0.33227200000000001 | U27: 0.62413700000000005 | V27: 15 | W27: 8.1032999999999994E-2 | X27: 15 | Y27: 0.40994199999999997 | Z27: 15 | AA27: 15
C28: 3.3363999999999998E-2 | D28: 3.2862000000000002E-2 | E28: 0.107784 | F28: 4.5650999999999997E-2 | G28: 5.6271000000000002E-2 | I28: 0.111929 | J28: 0.41800399999999999 | K28: 7.1598999999999996E-2 | L28: 8.8775999999999994E-2 | M28: 0.38766299999999998 | N28: 1.031809 | O28: 0.23921400000000001 | T28: 0.33227600000000002 | U28: 0.62405299999999997 | W28: 8.1225000000000006E-2 | Y28: 0.40993099999999999
C29: 3.3327000000000002E-2 | D29: 3.2853E-2 | E29: 0.10788200000000001 | F29: 4.5815000000000002E-2 | G29: 4.3513999999999997E-2 | H29: Error | I29: 0.111931 | J29: 0.41845900000000003 | K29: 7.1590000000000001E-2 | L29: 8.8532E-2 | M29: 0.38759100000000002 | N29: 1.0323059999999999 | O29: 0.238645 | P29: Error | Q29: Error | R29: Error | S29: Error | T29: 0.33217400000000002 | U29: 0.62411000000000005 | V29: Error | W29: 8.1140000000000004E-2 | X29: Error | Y29: 0.40995500000000001 | Z29: Error | AA29: Error
C30: 3.3333000000000002E-2 | D30: 3.2946000000000003E-2 | E30: 0.107833 | F30: 4.5692999999999998E-2 | G30: 4.3486999999999998E-2 | I30: 0.111925 | J30: 0.41848000000000002 | K30: 7.1581000000000006E-2 | L30: 8.8899000000000006E-2 | M30: 0.38763999999999998 | N30: 1.0325390000000001 | O30: 0.239283 | T30: 0.332316 | U30: 0.62456599999999995 | W30: 8.1033999999999995E-2 | Y30: 0.40990799999999999
C31: 3.3346000000000001E-2 | D31: 3.2787999999999998E-2 | E31: 0.107735 | F31: 4.5663000000000002E-2 | G31: 5.5944000000000001E-2 | I31: 0.11193 | J31: 0.41819400000000001 | K31: 7.1596999999999994E-2 | L31: 8.9052999999999993E-2 | M31: 0.38766200000000001 | N31: 1.031569 | O31: 0.23871600000000001 | T31: 0.33217799999999997 | U31: 0.62412199999999995 | W31: 8.1034999999999996E-2 | Y31: 0.41007100000000002
B32: 問題モンダイ６ | C32: 2.0627E-2 | D32: 2.1965999999999999E-2 | E32: 2.1409000000000001E-2 | F32: 2.3165000000000002E-2 | G32: 4.2091999999999997E-2 | H32: 2.2995999999999999E-2 | I32: 15 | J32: 15 | K32: 5.6344999999999999E-2 | L32: 5.5735E-2 | M32: 0.24127299999999999 | N32: 1.1211180000000001 | O32: 0.12781100000000001 | P32: 8.2196180000000005 | Q32: 15 | R32: 0.25933299999999998 | S32: 15 | T32: 0.199043 | U32: 0.53735599999999994 | V32: 0.194471 | W32: 6.1808000000000002E-2 | X32: 0.17629500000000001 | Y32: 0.187556 | Z32: 0.91728299999999996 | AA32: 15
C33: 2.0499E-2 | D33: 2.1951999999999999E-2 | E33: 2.1295000000000001E-2 | F33: 2.3147000000000001E-2 | G33: 2.9422E-2 | H33: 2.3043000000000001E-2 | K33: 5.6304E-2 | L33: 5.5731999999999997E-2 | M33: 0.24130499999999999 | N33: 1.120339 | O33: 0.12762599999999999 | P33: 8.2196219999999993 | R33: 0.25966499999999998 | T33: 0.199103 | U33: 0.53717899999999996 | V33: 0.194436 | W33: 6.1536E-2 | X33: 0.176263 | Y33: 0.187587 | Z33: 0.91625400000000001
C34: 2.0552000000000001E-2 | D34: 2.1944000000000002E-2 | E34: 2.1297E-2 | F34: 2.3144999999999999E-2 | G34: 4.2438999999999998E-2 | H34: 2.3043000000000001E-2 | I34: Error | J34: Error | K34: 5.6301999999999998E-2 | L34: 5.5763E-2 | M34: 0.24127100000000001 | N34: 1.1217649999999999 | O34: 0.12756400000000001 | P34: 8.2205929999999992 | Q34: Error | R34: 0.259774 | S34: Error | T34: 0.19911999999999999 | U34: 0.53766800000000003 | V34: 0.194413 | W34: 6.1594000000000003E-2 | X34: 0.17652899999999999 | Y34: 0.187554 | Z34: 0.91171599999999997 | AA34: Error
C35: 2.0632999999999999E-2 | D35: 2.1991E-2 | E35: 2.1361999999999999E-2 | F35: 2.3143E-2 | G35: 4.2353000000000002E-2 | H35: 2.3036000000000001E-2 | K35: 5.6474999999999997E-2 | L35: 5.6146000000000001E-2 | M35: 0.24122299999999999 | N35: 1.121462 | O35: 0.12756999999999999 | P35: 8.2185780000000008 | R35: 0.25956299999999999 | T35: 0.19909499999999999 | U35: 0.53721399999999997 | V35: 0.19445699999999999 | W35: 6.1595999999999998E-2 | X35: 0.176533 | Y35: 0.18765899999999999 | Z35: 0.91258399999999995
C36: 2.0535000000000001E-2 | D36: 2.2046E-2 | E36: 2.1448999999999999E-2 | F36: 2.3139E-2 | G36: 4.2360000000000002E-2 | H36: 2.2988000000000001E-2 | K36: 5.6530999999999998E-2 | L36: 5.6002999999999997E-2 | M36: 0.241337 | N36: 1.121804 | O36: 0.127805 | P36: 8.2202009999999994 | R36: 0.25936100000000001 | T36: 0.19919200000000001 | U36: 0.53705899999999995 | V36: 0.194383 | W36: 6.1671999999999998E-2 | X36: 0.17634 | Y36: 0.18756700000000001 | Z36: 0.91303199999999995
B37: 問題モンダイ７ | C37: 0.189778 | D37: 0.14596799999999999 | E37: 0.178007 | F37: 0.427533 | G37: 15 | H37: 15 | I37: 0.33762799999999998 | J37: 0.71473699999999996 | K37: 0.129777 | L37: 0.27996500000000002 | M37: 1.0252540000000001 | N37: 5.8885480000000001 | O37: 1.6998819999999999 | P37: 15 | Q37: 15 | R37: 3.3044790000000002 | S37: 15 | T37: 3.2319870000000002 | U37: 15 | V37: 1.450615 | W37: 1.4123289999999999 | X37: 1.3163480000000001 | Y37: 4.2281170000000001 | Z37: 15 | AA37: 15
C38: 0.18995899999999999 | D38: 0.145872 | E38: 0.17777999999999999 | F38: 0.42751899999999998 | I38: 0.33769199999999999 | J38: 0.71577599999999997 | K38: 0.12987799999999999 | L38: 0.27925800000000001 | M38: 1.025242 | N38: 5.887092 | O38: 1.6995389999999999 | R38: 3.3082039999999999 | T38: 3.2324079999999999 | V38: 1.36026 | W38: 1.4120889999999999 | X38: 1.314209 | Y38: 4.2282919999999997
C39: 0.18986700000000001 | D39: 0.14624999999999999 | E39: 0.177921 | F39: 0.42759799999999998 | G39: Error | H39: Error | I39: 0.33776699999999998 | J39: 0.71513599999999999 | K39: 0.129773 | L39: 0.27865600000000001 | M39: 1.02521 | N39: 5.8869129999999998 | O39: 1.699565 | P39: Error | Q39: Error | R39: 3.3079480000000001 | S39: Error | T39: 3.2321089999999999 | U39: Error | V39: 1.3915459999999999 | W39: 1.4121589999999999 | X39: 1.3139780000000001 | Y39: 4.2283929999999996 | Z39: Error | AA39: Error
C40: 0.18976100000000001 | D40: 0.14588100000000001 | E40: 0.17794099999999999 | F40: 0.42762299999999998 | I40: 0.33763199999999999 | J40: 0.715028 | K40: 0.12973299999999999 | L40: 0.27898000000000001 | M40: 1.0252479999999999 | N40: 5.8877959999999998 | O40: 1.6994229999999999 | R40: 3.3081870000000002 | T40: 3.2323379999999999 | V40: 1.451397 | W40: 1.4122300000000001 | X40: 1.313669 | Y40: 4.2285599999999999
C41: 0.189807 | D41: 0.145869 | E41: 0.17800099999999999 | F41: 0.427479 | I41: 0.33761999999999998 | J41: 0.71441600000000005 | K41: 0.12970400000000001 | L41: 0.27933599999999997 | M41: 1.025274 | N41: 5.887448 | O41: 1.699484 | R41: 3.3079079999999998 | T41: 3.2322700000000002 | V41: 1.4522600000000001 | W41: 1.4120429999999999 | X41: 1.3137270000000001 | Y41: 4.22844
B42: 問題モンダイ８ | C42: 0.31968600000000003 | D42: 0.22295400000000001 | E42: 0.19980000000000001 | F42: 0.77774600000000005 | G42: 15 | H42: 0.17219400000000001 | I42: 15 | J42: 0.72777400000000003 | K42: 0.193888 | L42: 0.24449899999999999 | M42: 1.3312269999999999 | N42: 15 | O42: 2.8362189999999998 | P42: 7.0249680000000003 | Q42: 15 | R42: 5.6793420000000001 | S42: 15 | T42: 5.6210490000000002 | U42: 15 | V42: 2.2698939999999999 | W42: 1.681856 | X42: 1.8769469999999999 | Y42: 7.2081309999999998 | Z42: 15 | AA42: 15
C43: 0.319882 | D43: 0.22283900000000001 | E43: 0.19986300000000001 | F43: 0.77780400000000005 | H43: 0.172157 | J43: 0.72727200000000003 | K43: 0.19537399999999999 | L43: 0.243783 | M43: 1.3313699999999999 | O43: 2.8360530000000002 | P43: 7.0245499999999996 | R43: 5.679081 | T43: 5.6200200000000002 | V43: 2.265117 | W43: 1.6822349999999999 | X43: 1.8772040000000001 | Y43: 7.2085590000000002
C44: 0.31937900000000002 | D44: 0.222938 | E44: 0.19982 | F44: 0.77775399999999995 | G44: Error | H44: 0.17211399999999999 | I44: Error | J44: 0.72702100000000003 | K44: 0.194021 | L44: 0.244029 | M44: 1.3313900000000001 | N44: Error | O44: 2.8358479999999999 | P44: 7.0247630000000001 | Q44: Error | R44: 5.6792319999999998 | S44: Error | T44: 5.6200679999999998 | U44: Error | V44: 2.2660749999999998 | W44: 1.68228 | X44: 1.8768389999999999 | Y44: 7.2075760000000004 | Z44: Error | AA44: Error
C45: 0.320025 | D45: 0.22295899999999999 | E45: 0.19982900000000001 | F45: 0.77778599999999998 | H45: 0.17205100000000001 | J45: 0.72840499999999997 | K45: 0.193962 | L45: 0.243478 | M45: 1.3314809999999999 | O45: 2.8358180000000002 | P45: 7.0247609999999998 | R45: 5.6774630000000004 | T45: 5.6197039999999996 | V45: 1.9352910000000001 | W45: 1.682817 | X45: 1.8769499999999999 | Y45: 7.2079329999999997
C46: 0.31991700000000001 | D46: 0.222858 | E46: 0.19997599999999999 | F46: 0.77780199999999999 | H46: 0.17213600000000001 | J46: 0.72853100000000004 | K46: 0.193887 | L46: 0.24470600000000001 | M46: 1.33125 | O46: 2.8359109999999998 | P46: 7.0245199999999999 | R46: 5.6767589999999997 | T46: 5.6205540000000003 | V46: 2.0165109999999999 | W46: 1.681972 | X46: 1.8769659999999999 | Y46: 7.2078699999999998
B47: 問題モンダイ９ | C47: 0.21940499999999999 | D47: 0.16857 | E47: 0.164825 | F47: 0.64367600000000003 | G47: 0.25761400000000001 | H47: 15 | I47: 0.40105800000000003 | J47: 15 | K47: 0.190386 | L47: 0.15565399999999999 | M47: 1.179702 | N47: 15 | O47: 2.7370589999999999 | P47: 7.9427580000000004 | Q47: 15 | R47: 5.1034600000000001 | S47: 15 | T47: 5.1408639999999997 | U47: 15 | V47: 2.3773780000000002 | W47: 1.634873 | X47: 1.573863 | Y47: 6.8473569999999997 | Z47: 15 | AA47: 15
C48: 0.219306 | D48: 0.16861100000000001 | E48: 0.16490299999999999 | F48: 0.64355899999999999 | G48: 0.25706400000000001 | I48: 0.40112100000000001 | K48: 0.190718 | L48: 0.15584100000000001 | M48: 1.1797740000000001 | O48: 2.7370510000000001 | P48: 7.9411440000000004 | R48: 5.1091629999999997 | T48: 5.1311200000000001 | V48: 2.3738450000000002 | W48: 1.635089 | X48: 1.5724260000000001 | Y48: 6.8456450000000002
C49: 0.21881999999999999 | D49: 0.16858899999999999 | E49: 0.164821 | F49: 0.64361000000000002 | G49: 0.25733400000000001 | H49: Error | I49: 0.401092 | J49: Error | K49: 0.189747 | L49: 0.155976 | M49: 1.1799299999999999 | N49: Error | O49: 2.7371859999999999 | P49: 7.9459429999999998 | Q49: Error | R49: 5.1026350000000003 | S49: Error | T49: 5.1357540000000004 | U49: Error | V49: 2.3807719999999999 | W49: 1.6353040000000001 | X49: 1.5682469999999999 | Y49: 6.8418260000000002 | Z49: Error | AA49: Error
C50: 0.21940399999999999 | D50: 0.16859199999999999 | E50: 0.16487099999999999 | F50: 0.64358300000000002 | G50: 0.25717699999999999 | I50: 0.40092800000000001 | K50: 0.19048899999999999 | L50: 0.155615 | M50: 1.179754 | O50: 2.736558 | P50: 7.9446159999999999 | R50: 5.1052770000000001 | T50: 5.1412890000000004 | V50: 2.3789150000000001 | W50: 1.6340049999999999 | X50: 1.571696 | Y50: 6.8430739999999997
C51: 0.21976799999999999 | D51: 0.16859199999999999 | E51: 0.16470799999999999 | F51: 0.64361500000000005 | G51: 0.25773099999999999 | I51: 0.40118100000000001 | K51: 0.18963099999999999 | L51: 0.15416099999999999 | M51: 1.1798329999999999 | O51: 2.737879 | P51: 7.9446219999999999 | R51: 5.1162109999999998 | T51: 5.1254619999999997 | V51: 2.3740350000000001 | W51: 1.6333059999999999 | X51: 1.573844 | Y51: 6.8462550000000002
B52: 問題モンダイ１０ | C52: 0.104143 | D52: 8.1786999999999999E-2 | E52: 0.11328199999999999 | F52: 0.21606700000000001 | G52: 15 | H52: 15 | I52: 0.25736399999999998 | J52: 0.63220600000000005 | K52: 0.106486 | L52: 0.15423799999999999 | M52: 0.70394299999999999 | N52: 15 | O52: 0.88199799999999995 | P52: 15 | Q52: 15 | R52: 15 | S52: 15 | T52: 15 | U52: 15 | V52: 0.67763799999999996 | W52: 0.244728 | X52: 15 | Y52: 2.1619769999999998 | Z52: 15 | AA52: 15
C53: 0.104392 | D53: 8.1802E-2 | E53: 0.11332200000000001 | F53: 0.21607799999999999 | I53: 0.25726700000000002 | J53: 0.63236099999999995 | K53: 0.10652499999999999 | L53: 0.15312799999999999 | M53: 0.70404599999999995 | O53: 0.88244199999999995 | V53: 0.678199 | W53: 0.244814 | Y53: 2.160974
C54: 0.104176 | D54: 8.1875000000000003E-2 | E54: 0.11333799999999999 | F54: 0.21601899999999999 | G54: Error | H54: Error | I54: 0.25736399999999998 | J54: 0.63208699999999995 | K54: 0.106404 | L54: 0.153499 | M54: 0.70402399999999998 | N54: Error | O54: 0.88261900000000004 | P54: Error | Q54: Error | R54: Error | S54: Error | T54: Error | U54: Error | V54: 0.67646399999999995 | W54: 0.24481 | X54: Error | Y54: 2.1610480000000001 | Z54: Error | AA54: Error
C55: 0.104292 | D55: 8.1487000000000004E-2 | E55: 0.113372 | F55: 0.216056 | I55: 0.25726700000000002 | J55: 0.632521 | K55: 0.10746 | L55: 0.15456900000000001 | M55: 0.70400700000000005 | O55: 0.88303100000000001 | V55: 0.67486400000000002 | W55: 0.24482999999999999 | Y55: 2.1610939999999998
C56: 0.104118 | D56: 8.1824999999999995E-2 | E56: 0.113277 | F56: 0.216055 | I56: 0.25719599999999998 | J56: 0.63219700000000001 | K56: 0.106532 | L56: 0.15468999999999999 | M56: 0.70403700000000002 | O56: 0.88279600000000003 | V56: 0.67833399999999999 | W56: 0.24481600000000001 | Y56: 2.1609690000000001
B58: Average (msec)
B59: 問題モンダイ１ | C59: =AVERAGE(C7:C11)*1000 -> 709.37580000000003 | D59: =AVERAGE(D7:D11)*1000 -> 489.12940000000003 | E59: =AVERAGE(E7:E11)*1000 -> 382.06280000000004 | F59: =AVERAGE(F7:F11)*1000 -> 1812.6101999999998 | G59: =AVERAGE(G7:G11)*1000 -> 15000 | H59: =AVERAGE(H7:H11)*1000 -> 373.47959999999995 | I59: =AVERAGE(I7:I11)*1000 -> 1085.9155999999998 | J59: =AVERAGE(J7:J11)*1000 -> 1090.2187999999999 | K59: =AVERAGE(K7:K11)*1000 -> 396.12199999999996 | L59: =AVERAGE(L7:L11)*1000 -> 1057.1902 | M59: =AVERAGE(M7:M11)*1000 -> 3087.0240000000003 | N59: =AVERAGE(N7:N11)*1000 -> 15000 | O59: =AVERAGE(O7:O11)*1000 -> 6809.1391999999996 | P59: =AVERAGE(P7:P11)*1000 -> 15000 | Q59: =AVERAGE(Q7:Q11)*1000 -> 15000 | R59: =AVERAGE(R7:R11)*1000 -> 15000 | S59: =AVERAGE(S7:S11)*1000 -> 15000 | T59: =AVERAGE(T7:T11)*1000 -> 15000 | U59: =AVERAGE(U7:U11)*1000 -> 15000 | V59: =AVERAGE(V7:V11)*1000 -> 15000 | W59: =AVERAGE(W7:W11)*1000 -> 3099.0212000000001 | X59: =AVERAGE(X7:X11)*1000 -> 4394.6319999999996 | Y59: =AVERAGE(Y7:Y11)*1000 -> 15000 | Z59: =AVERAGE(Z7:Z11)*1000 -> 15000 | AA59: =AVERAGE(AA7:AA11)*1000 -> 15000
B60: 問題モンダイ２ | C60: =AVERAGE(C12:C16)*1000 -> 324.5942 | D60: =AVERAGE(D12:D16)*1000 -> 225.5042 | E60: =AVERAGE(E12:E16)*1000 -> 213.06599999999997 | F60: =AVERAGE(F12:F16)*1000 -> 782.06700000000001 | G60: =AVERAGE(G12:G16)*1000 -> 15000 | H60: =AVERAGE(H12:H16)*1000 -> 174.69059999999999 | I60: =AVERAGE(I12:I16)*1000 -> 15000 | J60: =AVERAGE(J12:J16)*1000 -> 714.08939999999996 | K60: =AVERAGE(K12:K16)*1000 -> 192.02680000000001 | L60: =AVERAGE(L12:L16)*1000 -> 237.3758 | M60: =AVERAGE(M12:M16)*1000 -> 1335.9776000000002 | N60: =AVERAGE(N12:N16)*1000 -> 15000 | O60: =AVERAGE(O12:O16)*1000 -> 2939.4677999999999 | P60: =AVERAGE(P12:P16)*1000 -> 6815.9745999999996 | Q60: =AVERAGE(Q12:Q16)*1000 -> 15000 | R60: =AVERAGE(R12:R16)*1000 -> 5563.5208000000011 | S60: =AVERAGE(S12:S16)*1000 -> 5402.7646000000004 | T60: =AVERAGE(T12:T16)*1000 -> 5516.9719999999998 | U60: =AVERAGE(U12:U16)*1000 -> 6784.8041999999987 | V60: =AVERAGE(V12:V16)*1000 -> 2212.0428000000002 | W60: =AVERAGE(W12:W16)*1000 -> 1701.4386000000002 | X60: =AVERAGE(X12:X16)*1000 -> 1869.7194000000004 | Y60: =AVERAGE(Y12:Y16)*1000 -> 7361.5990000000002 | Z60: =AVERAGE(Z12:Z16)*1000 -> 15000 | AA60: =AVERAGE(AA12:AA16)*1000 -> 15000
B61: 問題モンダイ３ | C61: =AVERAGE(C17:C21)*1000 -> 21.276999999999997 | D61: =AVERAGE(D17:D21)*1000 -> 22.459599999999998 | E61: =AVERAGE(E17:E21)*1000 -> 21.734200000000001 | F61: =AVERAGE(F17:F21)*1000 -> 23.745800000000003 | G61: =AVERAGE(G17:G21)*1000 -> 40.217999999999996 | H61: =AVERAGE(H17:H21)*1000 -> 23.387799999999999 | I61: =AVERAGE(I17:I21)*1000 -> 15000 | J61: =AVERAGE(J17:J21)*1000 -> 292.85399999999998 | K61: =AVERAGE(K17:K21)*1000 -> 56.687999999999995 | L61: =AVERAGE(L17:L21)*1000 -> 56.416000000000004 | M61: =AVERAGE(M17:M21)*1000 -> 241.5642 | N61: =AVERAGE(N17:N21)*1000 -> 624.48239999999998 | O61: =AVERAGE(O17:O21)*1000 -> 124.9268 | P61: =AVERAGE(P17:P21)*1000 -> 7746.7328000000007 | Q61: =AVERAGE(Q17:Q21)*1000 -> 15000 | R61: =AVERAGE(R17:R21)*1000 -> 250.91439999999997 | S61: =AVERAGE(S17:S21)*1000 -> 142.00819999999999 | T61: =AVERAGE(T17:T21)*1000 -> 194.48880000000003 | U61: =AVERAGE(U17:U21)*1000 -> 323.18939999999998 | V61: =AVERAGE(V17:V21)*1000 -> 195.25380000000001 | W61: =AVERAGE(W17:W21)*1000 -> 62.270399999999988 | X61: =AVERAGE(X17:X21)*1000 -> 176.31820000000002 | Y61: =AVERAGE(Y17:Y21)*1000 -> 176.24340000000001 | Z61: =AVERAGE(Z17:Z21)*1000 -> 670.02679999999987 | AA61: =AVERAGE(AA17:AA21)*1000 -> 15000
B62: 問題モンダイ４ | C62: =AVERAGE(C22:C26)*1000 -> 20.630199999999999 | D62: =AVERAGE(D22:D26)*1000 -> 21.804600000000001 | E62: =AVERAGE(E22:E26)*1000 -> 20.763999999999999 | F62: =AVERAGE(F22:F26)*1000 -> 22.345200000000002 | G62: =AVERAGE(G22:G26)*1000 -> 27.648600000000002 | H62: =AVERAGE(H22:H26)*1000 -> 23.043600000000001 | I62: =AVERAGE(I22:I26)*1000 -> 75.29140000000001 | J62: =AVERAGE(J22:J26)*1000 -> 319.99879999999996 | K62: =AVERAGE(K22:K26)*1000 -> 55.574400000000004 | L62: =AVERAGE(L22:L26)*1000 -> 15000 | M62: =AVERAGE(M22:M26)*1000 -> 15000 | N62: =AVERAGE(N22:N26)*1000 -> 573.51640000000009 | O62: =AVERAGE(O22:O26)*1000 -> 15000 | P62: =AVERAGE(P22:P26)*1000 -> 15000 | Q62: =AVERAGE(Q22:Q26)*1000 -> 15000 | R62: =AVERAGE(R22:R26)*1000 -> 228.38919999999999 | S62: =AVERAGE(S22:S26)*1000 -> 117.63240000000002 | T62: =AVERAGE(T22:T26)*1000 -> 182.61679999999996 | U62: =AVERAGE(U22:U26)*1000 -> 468.03099999999995 | V62: =AVERAGE(V22:V26)*1000 -> 15000 | W62: =AVERAGE(W22:W26)*1000 -> 60.267599999999995 | X62: =AVERAGE(X22:X26)*1000 -> 231.46159999999998 | Y62: =AVERAGE(Y22:Y26)*1000 -> 139.7302 | Z62: =AVERAGE(Z22:Z26)*1000 -> 615.37980000000005 | AA62: =AVERAGE(AA22:AA26)*1000 -> 15000
B63: 問題モンダイ５ | C63: =AVERAGE(C27:C31)*1000 -> 33.335999999999999 | D63: =AVERAGE(D27:D31)*1000 -> 32.859799999999993 | E63: =AVERAGE(E27:E31)*1000 -> 107.80940000000001 | F63: =AVERAGE(F27:F31)*1000 -> 45.696599999999997 | G63: =AVERAGE(G27:G31)*1000 -> 51.086800000000004 | H63: =AVERAGE(H27:H31)*1000 -> 15000 | I63: =AVERAGE(I27:I31)*1000 -> 111.9254 | J63: =AVERAGE(J27:J31)*1000 -> 418.29060000000004 | K63: =AVERAGE(K27:K31)*1000 -> 71.58720000000001 | L63: =AVERAGE(L27:L31)*1000 -> 88.849399999999989 | M63: =AVERAGE(M27:M31)*1000 -> 387.64279999999997 | N63: =AVERAGE(N27:N31)*1000 -> 1032.1127999999999 | O63: =AVERAGE(O27:O31)*1000 -> 238.94220000000001 | P63: =AVERAGE(P27:P31)*1000 -> 15000 | Q63: =AVERAGE(Q27:Q31)*1000 -> 15000 | R63: =AVERAGE(R27:R31)*1000 -> 15000 | S63: =AVERAGE(S27:S31)*1000 -> 15000 | T63: =AVERAGE(T27:T31)*1000 -> 332.2432 | U63: =AVERAGE(U27:U31)*1000 -> 624.19759999999985 | V63: =AVERAGE(V27:V31)*1000 -> 15000 | W63: =AVERAGE(W27:W31)*1000 -> 81.093400000000017 | X63: =AVERAGE(X27:X31)*1000 -> 15000 | Y63: =AVERAGE(Y27:Y31)*1000 -> 409.96139999999997 | Z63: =AVERAGE(Z27:Z31)*1000 -> 15000 | AA63: =AVERAGE(AA27:AA31)*1000 -> 15000
B64: 問題モンダイ６ | C64: =AVERAGE(C32:C36)*1000 -> 20.569199999999999 | D64: =AVERAGE(D32:D36)*1000 -> 21.979800000000001 | E64: =AVERAGE(E32:E36)*1000 -> 21.362399999999997 | F64: =AVERAGE(F32:F36)*1000 -> 23.147800000000004 | G64: =AVERAGE(G32:G36)*1000 -> 39.733200000000004 | H64: =AVERAGE(H32:H36)*1000 -> 23.0212 | I64: =AVERAGE(I32:I36)*1000 -> 15000 | J64: =AVERAGE(J32:J36)*1000 -> 15000 | K64: =AVERAGE(K32:K36)*1000 -> 56.391400000000004 | L64: =AVERAGE(L32:L36)*1000 -> 55.875799999999998 | M64: =AVERAGE(M32:M36)*1000 -> 241.28179999999998 | N64: =AVERAGE(N32:N36)*1000 -> 1121.2975999999999 | O64: =AVERAGE(O32:O36)*1000 -> 127.67520000000002 | P64: =AVERAGE(P32:P36)*1000 -> 8219.7224000000006 | Q64: =AVERAGE(Q32:Q36)*1000 -> 15000 | R64: =AVERAGE(R32:R36)*1000 -> 259.53919999999999 | S64: =AVERAGE(S32:S36)*1000 -> 15000 | T64: =AVERAGE(T32:T36)*1000 -> 199.11060000000001 | U64: =AVERAGE(U32:U36)*1000 -> 537.29520000000002 | V64: =AVERAGE(V32:V36)*1000 -> 194.43199999999999 | W64: =AVERAGE(W32:W36)*1000 -> 61.641200000000005 | X64: =AVERAGE(X32:X36)*1000 -> 176.39200000000002 | Y64: =AVERAGE(Y32:Y36)*1000 -> 187.58460000000002 | Z64: =AVERAGE(Z32:Z36)*1000 -> 914.17380000000003 | AA64: =AVERAGE(AA32:AA36)*1000 -> 15000
B65: 問題モンダイ７ | C65: =AVERAGE(C37:C41)*1000 -> 189.83440000000002 | D65: =AVERAGE(D37:D41)*1000 -> 145.96800000000002 | E65: =AVERAGE(E37:E41)*1000 -> 177.93 | F65: =AVERAGE(F37:F41)*1000 -> 427.55040000000002 | G65: =AVERAGE(G37:G41)*1000 -> 15000 | H65: =AVERAGE(H37:H41)*1000 -> 15000 | I65: =AVERAGE(I37:I41)*1000 -> 337.66779999999994 | J65: =AVERAGE(J37:J41)*1000 -> 715.01859999999999 | K65: =AVERAGE(K37:K41)*1000 -> 129.773 | L65: =AVERAGE(L37:L41)*1000 -> 279.23900000000003 | M65: =AVERAGE(M37:M41)*1000 -> 1025.2456 | N65: =AVERAGE(N37:N41)*1000 -> 5887.5593999999992 | O65: =AVERAGE(O37:O41)*1000 -> 1699.5786000000001 | P65: =AVERAGE(P37:P41)*1000 -> 15000 | Q65: =AVERAGE(Q37:Q41)*1000 -> 15000 | R65: =AVERAGE(R37:R41)*1000 -> 3307.3452000000002 | S65: =AVERAGE(S37:S41)*1000 -> 15000 | T65: =AVERAGE(T37:T41)*1000 -> 3232.2224000000001 | U65: =AVERAGE(U37:U41)*1000 -> 15000 | V65: =AVERAGE(V37:V41)*1000 -> 1421.2156 | W65: =AVERAGE(W37:W41)*1000 -> 1412.17 | X65: =AVERAGE(X37:X41)*1000 -> 1314.3861999999999 | Y65: =AVERAGE(Y37:Y41)*1000 -> 4228.3603999999996 | Z65: =AVERAGE(Z37:Z41)*1000 -> 15000 | AA65: =AVERAGE(AA37:AA41)*1000 -> 15000
B66: 問題モンダイ８ | C66: =AVERAGE(C42:C46)*1000 -> 319.77780000000001 | D66: =AVERAGE(D42:D46)*1000 -> 222.90960000000001 | E66: =AVERAGE(E42:E46)*1000 -> 199.85759999999999 | F66: =AVERAGE(F42:F46)*1000 -> 777.77840000000003 | G66: =AVERAGE(G42:G46)*1000 -> 15000 | H66: =AVERAGE(H42:H46)*1000 -> 172.13039999999998 | I66: =AVERAGE(I42:I46)*1000 -> 15000 | J66: =AVERAGE(J42:J46)*1000 -> 727.80059999999992 | K66: =AVERAGE(K42:K46)*1000 -> 194.22639999999998 | L66: =AVERAGE(L42:L46)*1000 -> 244.09899999999999 | M66: =AVERAGE(M42:M46)*1000 -> 1331.3435999999999 | N66: =AVERAGE(N42:N46)*1000 -> 15000 | O66: =AVERAGE(O42:O46)*1000 -> 2835.9697999999999 | P66: =AVERAGE(P42:P46)*1000 -> 7024.7124000000003 | Q66: =AVERAGE(Q42:Q46)*1000 -> 15000 | R66: =AVERAGE(R42:R46)*1000 -> 5678.3753999999999 | S66: =AVERAGE(S42:S46)*1000 -> 15000 | T66: =AVERAGE(T42:T46)*1000 -> 5620.2789999999995 | U66: =AVERAGE(U42:U46)*1000 -> 15000 | V66: =AVERAGE(V42:V46)*1000 -> 2150.5775999999996 | W66: =AVERAGE(W42:W46)*1000 -> 1682.2320000000002 | X66: =AVERAGE(X42:X46)*1000 -> 1876.9812000000002 | Y66: =AVERAGE(Y42:Y46)*1000 -> 7208.0138000000006 | Z66: =AVERAGE(Z42:Z46)*1000 -> 15000 | AA66: =AVERAGE(AA42:AA46)*1000 -> 15000
B67: 問題モンダイ９ | C67: =AVERAGE(C47:C51)*1000 -> 219.34059999999999 | D67: =AVERAGE(D47:D51)*1000 -> 168.59079999999997 | E67: =AVERAGE(E47:E51)*1000 -> 164.82559999999998 | F67: =AVERAGE(F47:F51)*1000 -> 643.60860000000014 | G67: =AVERAGE(G47:G51)*1000 -> 257.38399999999996 | H67: =AVERAGE(H47:H51)*1000 -> 15000 | I67: =AVERAGE(I47:I51)*1000 -> 401.07599999999991 | J67: =AVERAGE(J47:J51)*1000 -> 15000 | K67: =AVERAGE(K47:K51)*1000 -> 190.1942 | L67: =AVERAGE(L47:L51)*1000 -> 155.44940000000003 | M67: =AVERAGE(M47:M51)*1000 -> 1179.7985999999999 | N67: =AVERAGE(N47:N51)*1000 -> 15000 | O67: =AVERAGE(O47:O51)*1000 -> 2737.1466 | P67: =AVERAGE(P47:P51)*1000 -> 7943.8166000000001 | Q67: =AVERAGE(Q47:Q51)*1000 -> 15000 | R67: =AVERAGE(R47:R51)*1000 -> 5107.3491999999997 | S67: =AVERAGE(S47:S51)*1000 -> 15000 | T67: =AVERAGE(T47:T51)*1000 -> 5134.8977999999997 | U67: =AVERAGE(U47:U51)*1000 -> 15000 | V67: =AVERAGE(V47:V51)*1000 -> 2376.9889999999996 | W67: =AVERAGE(W47:W51)*1000 -> 1634.5154000000002 | X67: =AVERAGE(X47:X51)*1000 -> 1572.0152000000003 | Y67: =AVERAGE(Y47:Y51)*1000 -> 6844.8313999999991 | Z67: =AVERAGE(Z47:Z51)*1000 -> 15000 | AA67: =AVERAGE(AA47:AA51)*1000 -> 15000
B68: 問題モンダイ１０ | C68: =AVERAGE(C52:C56)*1000 -> 104.22420000000001 | D68: =AVERAGE(D52:D56)*1000 -> 81.755200000000002 | E68: =AVERAGE(E52:E56)*1000 -> 113.31819999999999 | F68: =AVERAGE(F52:F56)*1000 -> 216.05500000000001 | G68: =AVERAGE(G52:G56)*1000 -> 15000 | H68: =AVERAGE(H52:H56)*1000 -> 15000 | I68: =AVERAGE(I52:I56)*1000 -> 257.29160000000002 | J68: =AVERAGE(J52:J56)*1000 -> 632.27440000000001 | K68: =AVERAGE(K52:K56)*1000 -> 106.6814 | L68: =AVERAGE(L52:L56)*1000 -> 154.02480000000003 | M68: =AVERAGE(M52:M56)*1000 -> 704.01139999999998 | N68: =AVERAGE(N52:N56)*1000 -> 15000 | O68: =AVERAGE(O52:O56)*1000 -> 882.57720000000006 | P68: =AVERAGE(P52:P56)*1000 -> 15000 | Q68: =AVERAGE(Q52:Q56)*1000 -> 15000 | R68: =AVERAGE(R52:R56)*1000 -> 15000 | S68: =AVERAGE(S52:S56)*1000 -> 15000 | T68: =AVERAGE(T52:T56)*1000 -> 15000 | U68: =AVERAGE(U52:U56)*1000 -> 15000 | V68: =AVERAGE(V52:V56)*1000 -> 677.09979999999996 | W68: =AVERAGE(W52:W56)*1000 -> 244.79959999999997 | X68: =AVERAGE(X52:X56)*1000 -> 15000 | Y68: =AVERAGE(Y52:Y56)*1000 -> 2161.2123999999999 | Z68: =AVERAGE(Z52:Z56)*1000 -> 15000 | AA68: =AVERAGE(AA52:AA56)*1000 -> 15000
B70: Point | C70: 10 | D70: 7 | E70: 5 | F70: 4 | G70: 3 | H70: 2 | I70: 1
B71: 問題モンダイ１ | C71: 373.47959999999995 | D71: 382.06280000000004 | E71: 396.12199999999996 | F71: 489.12940000000003 | G71: 709.37580000000003 | H71: 1057.1902 | I71: 1085.9155999999998 | J71: 1090.2187999999999 | K71: 1812.6101999999998 | L71: 3087.0240000000003 | M71: 3099.0212000000001 | N71: 4394.6319999999996 | O71: 6809.1391999999996 | P71: 15000 | Q71: 15000 | R71: 15000 | S71: 15000 | T71: 15000 | U71: 15000 | V71: 15000 | W71: 15000 | X71: 15000 | Y71: 15000 | Z71: 15000 | AA71: 15000
B72: チーム | C72: 335 | D72: 312 | E72: 302 | F72: 306 | G72: 340 | H72: 307 | I72: 331 | J72: 311 | K72: 304 | L72: 308 | M72: 334 | N72: 337 | O72: 315 | P72: 318 | Q72: 313 | R72: 321 | S72: 322 | T72: 323 | U72: 325 | V72: 326 | W72: 328 | X72: 333 | Y72: 338 | Z72: 343 | AA72: 344
C73: diff | D73: =D71-C71 -> 8.5832000000000903 | E73: =E71-D71 -> 14.059199999999919 | F73: =F71-E71 -> 93.007400000000075 | G73: =G71-F71 -> 220.24639999999999 | H73: =H71-G71 -> 347.81439999999998 | I73: =I71-H71 -> 28.725399999999809 | J73: =J71-I71 -> 4.3032000000000608 | K73: =K71-J71 -> 722.39139999999998
B75: 問題モンダイ２ | C75: 174.69059999999999 | D75: 192.02680000000001 | E75: 213.06599999999997 | F75: 225.5042 | G75: 237.3758 | H75: 324.5942 | I75: 714.08939999999996 | J75: 782.06700000000001 | K75: 1335.9776000000002 | L75: 1701.4386000000002 | M75: 1869.7194000000004 | N75: 2212.0428000000002 | O75: 2939.4677999999999 | P75: 5402.7646000000004 | Q75: 5516.9719999999998 | R75: 5563.5208000000011 | S75: 6784.8041999999987 | T75: 6815.9745999999996 | U75: 7361.5990000000002 | V75: 15000 | W75: 15000 | X75: 15000 | Y75: 15000 | Z75: 15000 | AA75: 15000
B76: チーム | C76: 335 | D76: 302 | E76: 312 | F76: 306 | G76: 307 | H76: 340 | I76: 311 | J76: 304 | K76: 308 | L76: 334 | M76: 337 | N76: 333 | O76: 315 | P76: 325 | Q76: 326 | R76: 323 | S76: 328 | T76: 321 | U76: 338 | V76: 318 | W76: 331 | X76: 313 | Y76: 322 | Z76: 343 | AA76: 344
C77: diff | D77: =D75-C75 -> 17.336200000000019 | E77: =E75-D75 -> 21.039199999999965 | F77: =F75-E75 -> 12.438200000000023 | G77: =G75-F75 -> 11.871600000000001 | H77: =H75-G75 -> 87.218400000000003 | I77: =I75-H75 -> 389.49519999999995 | J77: =J75-I75 -> 67.977600000000052 | K77: =K75-J75 -> 553.91060000000016
B79: 問題モンダイ３ | C79: 21.276999999999997 | D79: 21.734200000000001 | E79: 22.459599999999998 | F79: 23.387799999999999 | G79: 23.745800000000003 | H79: 40.217999999999996 | I79: 56.416000000000004 | J79: 56.687999999999995 | K79: 62.270399999999988 | L79: 124.9268 | M79: 142.00819999999999 | N79: 176.24340000000001 | O79: 176.31820000000002 | P79: 194.48880000000003 | Q79: 195.25380000000001 | R79: 241.5642 | S79: 250.91439999999997 | T79: 292.85399999999998 | U79: 323.18939999999998 | V79: 624.48239999999998 | W79: 670.02679999999987 | X79: 7746.7328000000007 | Y79: 15000 | Z79: 15000 | AA79: 15000
B80: チーム | C80: 340 | D80: 312 | E80: 306 | F80: 335 | G80: 304 | H80: 318 | I80: 307 | J80: 302 | K80: 334 | L80: 315 | M80: 325 | N80: 338 | O80: 337 | P80: 326 | Q80: 333 | R80: 308 | S80: 323 | T80: 311 | U80: 328 | V80: 313 | W80: 343 | X80: 321 | Y80: 331 | Z80: 322 | AA80: 344
C81: diff | D81: =D79-C79 -> 0.45720000000000383 | E81: =E79-D79 -> 0.72539999999999694 | F81: =F79-E79 -> 0.92820000000000036 | G81: =G79-F79 -> 0.35800000000000409 | H81: =H79-G79 -> 16.472199999999994 | I81: =I79-H79 -> 16.198000000000008 | J81: =J79-I79 -> 0.27199999999999136 | K81: =K79-J79 -> 5.5823999999999927
B83: 問題モンダイ４ | C83: 20.630199999999999 | D83: 20.763999999999999 | E83: 21.804600000000001 | F83: 22.345200000000002 | G83: 23.043600000000001 | H83: 27.648600000000002 | I83: 55.574400000000004 | J83: 60.267599999999995 | K83: 75.29140000000001 | L83: 117.63240000000002 | M83: 139.7302 | N83: 182.61679999999996 | O83: 228.38919999999999 | P83: 231.46159999999998 | Q83: 319.99879999999996 | R83: 468.03099999999995 | S83: 573.51640000000009 | T83: 615.37980000000005 | U83: 15000 | V83: 15000 | W83: 15000 | X83: 15000 | Y83: 15000 | Z83: 15000 | AA83: 15000
B84: チーム | C84: 340 | D84: 312 | E84: 306 | F84: 304 | G84: 335 | H84: 318 | I84: 302 | J84: 334 | K84: 331 | L84: 325 | M84: 338 | N84: 326 | O84: 323 | P84: 337 | Q84: 311 | R84: 328 | S84: 313 | T84: 343 | U84: 307 | V84: 308 | W84: 315 | X84: 321 | Y84: 322 | Z84: 333 | AA84: 344
C85: diff | D85: =D83-C83 -> 0.13380000000000081 | E85: =E83-D83 -> 1.0406000000000013 | F85: =F83-E83 -> 0.5406000000000013 | G85: =G83-F83 -> 0.69839999999999947 | H85: =H83-G83 -> 4.6050000000000004 | I85: =I83-H83 -> 27.925800000000002 | J85: =J83-I83 -> 4.6931999999999903 | K85: =K83-J83 -> 15.023800000000016
B87: 問題モンダイ５ | C87: 32.859799999999993 | D87: 33.335999999999999 | E87: 45.696599999999997 | F87: 51.086800000000004 | G87: 71.58720000000001 | H87: 81.093400000000017 | I87: 88.849399999999989 | J87: 107.80940000000001 | K87: 111.9254 | L87: 238.94220000000001 | M87: 332.2432 | N87: 387.64279999999997 | O87: 409.96139999999997 | P87: 418.29060000000004 | Q87: 624.19759999999985 | R87: 1032.1127999999999 | S87: 15000 | T87: 15000 | U87: 15000 | V87: 15000 | W87: 15000 | X87: 15000 | Y87: 15000 | Z87: 15000 | AA87: 15000
B88: チーム | C88: 306 | D88: 340 | E88: 304 | F88: 318 | G88: 302 | H88: 334 | I88: 307 | J88: 312 | K88: 331 | L88: 315 | M88: 326 | N88: 308 | O88: 338 | P88: 311 | Q88: 328 | R88: 313 | S88: 335 | T88: 321 | U88: 322 | V88: 323 | W88: 325 | X88: 333 | Y88: 337 | Z88: 343 | AA88: 344
C89: diff | D89: =D87-C87 -> 0.47620000000000573 | E89: =E87-D87 -> 12.360599999999998 | F89: =F87-E87 -> 5.3902000000000072 | G89: =G87-F87 -> 20.500400000000006 | H89: =H87-G87 -> 9.5062000000000069 | I89: =I87-H87 -> 7.7559999999999718 | J89: =J87-I87 -> 18.96 | K89: =K87-J87 -> 4.1159999999999854
B91: 問題モンダイ６ | C91: 20.569199999999999 | D91: 21.362399999999997 | E91: 21.979800000000001 | F91: 23.0212 | G91: 23.147800000000004 | H91: 39.733200000000004 | I91: 55.875799999999998 | J91: 56.391400000000004 | K91: 61.641200000000005 | L91: 127.67520000000002 | M91: 176.39200000000002 | N91: 187.58460000000002 | O91: 194.43199999999999 | P91: 199.11060000000001 | Q91: 241.28179999999998 | R91: 259.53919999999999 | S91: 537.29520000000002 | T91: 914.17380000000003 | U91: 1121.2975999999999 | V91: 8219.7224000000006 | W91: 15000 | X91: 15000 | Y91: 15000 | Z91: 15000 | AA91: 15000
B92: チーム | C92: 340 | D92: 312 | E92: 306 | F92: 335 | G92: 304 | H92: 318 | I92: 307 | J92: 302 | K92: 334 | L92: 315 | M92: 337 | N92: 338 | O92: 333 | P92: 326 | Q92: 308 | R92: 323 | S92: 328 | T92: 343 | U92: 313 | V92: 321 | W92: 331 | X92: 311 | Y92: 322 | Z92: 325 | AA92: 344
C93: diff | D93: =D91-C91 -> 0.79319999999999879 | E93: =E91-D91 -> 0.6174000000000035 | F93: =F91-E91 -> 1.0413999999999994 | G93: =G91-F91 -> 0.12660000000000338 | H93: =H91-G91 -> 16.5854 | I93: =I91-H91 -> 16.142599999999995 | J93: =J91-I91 -> 0.51560000000000628 | K93: =K91-J91 -> 5.2498000000000005
B95: 問題モンダイ７ | C95: 129.773 | D95: 145.96800000000002 | E95: 177.93 | F95: 189.83440000000002 | G95: 279.23900000000003 | H95: 337.66779999999994 | I95: 427.55040000000002 | J95: 715.01859999999999 | K95: 1025.2456 | L95: 1314.3861999999999 | M95: 1412.17 | N95: 1421.2156 | O95: 1699.5786000000001 | P95: 3232.2224000000001 | Q95: 3307.3452000000002 | R95: 4228.3603999999996 | S95: 5887.5593999999992 | T95: 15000 | U95: 15000 | V95: 15000 | W95: 15000 | X95: 15000 | Y95: 15000 | Z95: 15000 | AA95: 15000
B96: チーム | C96: 302 | D96: 306 | E96: 312 | F96: 340 | G96: 307 | H96: 331 | I96: 304 | J96: 311 | K96: 308 | L96: 337 | M96: 334 | N96: 333 | O96: 315 | P96: 326 | Q96: 323 | R96: 338 | S96: 313 | T96: 318 | U96: 335 | V96: 321 | W96: 322 | X96: 325 | Y96: 328 | Z96: 343 | AA96: 344
C97: diff | D97: =D95-C95 -> 16.195 | E97: =E95-D95 -> 31.961999999999989 | F97: =F95-E95 -> 11.90440000000001 | G97: =G95-F95 -> 89.404600000000016 | H97: =H95-G95 -> 58.42879999999991 | I97: =I95-H95 -> 89.882600000000082 | J97: =J95-I95 -> 287.46819999999997 | K97: =K95-J95 -> 310.22699999999998
B99: 問題モンダイ８ | C99: 172.13039999999998 | D99: 194.22639999999998 | E99: 199.85759999999999 | F99: 222.90960000000001 | G99: 244.09899999999999 | H99: 319.77780000000001 | I99: 727.80059999999992 | J99: 777.77840000000003 | K99: 1331.3435999999999 | L99: 1682.2320000000002 | M99: 1876.9812000000002 | N99: 2150.5775999999996 | O99: 2835.9697999999999 | P99: 5620.2789999999995 | Q99: 5678.3753999999999 | R99: 7024.7124000000003 | S99: 7208.0138000000006 | T99: 15000 | U99: 15000 | V99: 15000 | W99: 15000 | X99: 15000 | Y99: 15000 | Z99: 15000 | AA99: 15000
B100: チーム | C100: 335 | D100: 302 | E100: 312 | F100: 306 | G100: 307 | H100: 340 | I100: 311 | J100: 304 | K100: 308 | L100: 334 | M100: 337 | N100: 333 | O100: 315 | P100: 326 | Q100: 323 | R100: 321 | S100: 338 | T100: 318 | U100: 331 | V100: 313 | W100: 322 | X100: 325 | Y100: 328 | Z100: 343 | AA100: 344
C101: diff | D101: =D99-C99 -> 22.096000000000004 | E101: =E99-D99 -> 5.6312000000000069 | F101: =F99-E99 -> 23.052000000000021 | G101: =G99-F99 -> 21.189399999999978 | H101: =H99-G99 -> 75.678800000000024 | I101: =I99-H99 -> 408.0227999999999 | J101: =J99-I99 -> 49.977800000000116 | K101: =K99-J99 -> 553.56519999999989
B103: 問題モンダイ９ | C103: 155.44940000000003 | D103: 164.82559999999998 | E103: 168.59079999999997 | F103: 190.1942 | G103: 219.34059999999999 | H103: 257.38399999999996 | I103: 401.07599999999991 | J103: 643.60860000000014 | K103: 1179.7985999999999 | L103: 1572.0152000000003 | M103: 1634.5154000000002 | N103: 2376.9889999999996 | O103: 2737.1466 | P103: 5107.3491999999997 | Q103: 5134.8977999999997 | R103: 6844.8313999999991 | S103: 7943.8166000000001 | T103: 15000 | U103: 15000 | V103: 15000 | W103: 15000 | X103: 15000 | Y103: 15000 | Z103: 15000 | AA103: 15000
B104: チーム | C104: 307 | D104: 312 | E104: 306 | F104: 302 | G104: 340 | H104: 318 | I104: 331 | J104: 304 | K104: 308 | L104: 337 | M104: 334 | N104: 333 | O104: 315 | P104: 323 | Q104: 326 | R104: 338 | S104: 321 | T104: 335 | U104: 311 | V104: 313 | W104: 322 | X104: 325 | Y104: 328 | Z104: 343 | AA104: 344
C105: diff | D105: =D103-C103 -> 9.3761999999999546 | E105: =E103-D103 -> 3.765199999999993 | F105: =F103-E103 -> 21.603400000000022 | G105: =G103-F103 -> 29.1464 | H105: =H103-G103 -> 38.043399999999963 | I105: =I103-H103 -> 143.69199999999995 | J105: =J103-I103 -> 242.53260000000023 | K105: =K103-J103 -> 536.19
B107: 問題モンダイ１０ | C107: 81.755200000000002 | D107: 104.22420000000001 | E107: 106.6814 | F107: 113.31819999999999 | G107: 154.02480000000003 | H107: 216.05500000000001 | I107: 244.79959999999997 | J107: 257.29160000000002 | K107: 632.27440000000001 | L107: 677.09979999999996 | M107: 704.01139999999998 | N107: 882.57720000000006 | O107: 2161.2123999999999 | P107: 15000 | Q107: 15000 | R107: 15000 | S107: 15000 | T107: 15000 | U107: 15000 | V107: 15000 | W107: 15000 | X107: 15000 | Y107: 15000 | Z107: 15000 | AA107: 15000
B108: チーム | C108: 306 | D108: 340 | E108: 302 | F108: 312 | G108: 307 | H108: 304 | I108: 334 | J108: 331 | K108: 311 | L108: 333 | M108: 308 | N108: 315 | O108: 338 | P108: 318 | Q108: 335 | R108: 313 | S108: 321 | T108: 322 | U108: 323 | V108: 325 | W108: 326 | X108: 328 | Y108: 337 | Z108: 343 | AA108: 344
C109: diff | D109: =D107-C107 -> 22.469000000000008 | E109: =E107-D107 -> 2.4571999999999861 | F109: =F107-E107 -> 6.6367999999999938 | G109: =G107-F107 -> 40.706600000000037 | H109: =H107-G107 -> 62.030199999999979 | I109: =I107-H107 -> 28.744599999999963 | J109: =J107-I107 -> 12.492000000000047 | K109: =K107-J107 -> 374.9828
B111: Team | C111: 340 | D111: 306 | E111: 312 | F111: 304 | G111: 318 | H111: 335 | I111: 331 | J111: 311 | K111: 302 | L111: 307 | M111: 308 | N111: 313 | O111: 315 | P111: 321 | Q111: 322 | R111: 323 | S111: 325 | T111: 326 | U111: 328 | V111: 333 | W111: 334 | X111: 337 | Y111: 338 | Z111: 343 | AA111: 344
B112: 予選ヨセンPT | C112: 21 | D112: 16 | E112: 12 | F112: 9 | G112: 8 | H112: 7 | I112: 2 | J112: 1 | K112: 0 | L112: 0 | M112: 0 | N112: 0 | O112: 0 | P112: 0 | Q112: 0 | R112: 0 | S112: 0 | T112: 0 | U112: 0 | V112: 0 | W112: 0 | X112: 0 | Y112: 0 | Z112: 0 | AA112: 0 | AB112: =SUM(C114:AA114) -> 76
B113: 問題モンダイ１ | C113: 3 | D113: 4 | E113: 7 | H113: 10 | I113: 1 | K113: 5 | L113: 2 | AB113: =SUM(C115:AA115) -> 32
B114: 問題モンダイ２ | C114: 2 | D114: 4 | E114: 5 | H114: 10 | J114: 1 | K114: 7 | L114: 3 | AB114: =SUM(C116:AA116) -> 32
B115: 問題モンダイ３ | C115: 10 | D115: 5 | E115: 10 | F115: 4 | G115: 2 | H115: 4 | K115: 1 | L115: 1 | AB115: =SUM(C117:AA117) -> 37
B116: 問題モンダイ４ | C116: 10 | D116: 5 | E116: 10 | F116: 4 | G116: 2 | H116: 3 | K116: 1 | AB116: =SUM(C118:AA118) -> 35
B117: 問題モンダイ５ | C117: 10 | D117: 10 | F117: 5 | G117: 4 | K117: 3 | L117: 1 | W117: 2 | AB117: =SUM(C119:AA119) -> 35
B118: 問題モンダイ６ | C118: 10 | D118: 5 | E118: 7 | F118: 4 | G118: 2 | H118: 4 | L118: 1 | AB118: =SUM(C120:AA120) -> 33
B119: 問題モンダイ７ | C119: 4 | D119: 7 | E119: 5 | F119: 1 | I119: 2 | K119: 10 | L119: 3 | AB119: =SUM(C121:AA121) -> 32
B120: 問題モンダイ８ | C120: 2 | D120: 4 | E120: 5 | H120: 10 | J120: 1 | K120: 7 | L120: 3 | AB120: =SUM(C122:AA122) -> 32
B121: 問題モンダイ９ | C121: 3 | D121: 5 | E121: 7 | G121: 2 | I121: 1 | K121: 4 | L121: 10 | AB121: =SUM(C123:AA123) -> 32
B122: 問題モンダイ１０ | C122: 7 | D122: 10 | E122: 4 | F122: 2 | K122: 5 | L122: 3 | W122: 1 | AB122: =SUM(C124:AA124) -> 32
AB123: =SUM(AB115:AB124) -> 332
B124: Total | C124: =SUM(C114:C124) -> 82 | D124: =SUM(D114:D124) -> 75 | E124: =SUM(E114:E124) -> 72 | F124: =SUM(F114:F124) -> 29 | G124: =SUM(G114:G124) -> 20 | H124: =SUM(H114:H124) -> 48 | I124: =SUM(I114:I124) -> 6 | J124: =SUM(J114:J124) -> 3 | K124: =SUM(K114:K124) -> 43 | L124: =SUM(L114:L124) -> 27 | M124: =SUM(M114:M124) -> 0 | N124: =SUM(N114:N124) -> 0 | O124: =SUM(O114:O124) -> 0 | P124: =SUM(P114:P124) -> 0 | Q124: =SUM(Q114:Q124) -> 0 | R124: =SUM(R114:R124) -> 0 | S124: =SUM(S114:S124) -> 0 | T124: =SUM(T114:T124) -> 0 | U124: =SUM(U114:U124) -> 0 | V124: =SUM(V114:V124) -> 0 | W124: =SUM(W114:W124) -> 3 | X124: =SUM(X114:X124) -> 0 | Y124: =SUM(Y114:Y124) -> 0 | Z124: =SUM(Z114:Z124) -> 0 | AA124: =SUM(AA114:AA124) -> 0 | AB124: =SUM(C126:AA126) -> 408
B126: ポイントでソート
B127: Team | C127: 340 | D127: 306 | E127: 312 | F127: 335 | G127: 302 | H127: 304 | I127: 307 | J127: 318 | K127: 331 | L127: 311 | M127: 334 | N127: 308 | O127: 313 | P127: 315 | Q127: 321 | R127: 322 | S127: 323 | T127: 325 | U127: 326 | V127: 328 | W127: 333 | X127: 337 | Y127: 338 | Z127: 343 | AA127: 344
B128: Total | C128: 82 | D128: 75 | E128: 72 | F128: 48 | G128: 43 | H128: 29 | I128: 27 | J128: 20 | K128: 6 | L128: 3 | M128: 3 | N128: 0 | O128: 0 | P128: 0 | Q128: 0 | R128: 0 | S128: 0 | T128: 0 | U128: 0 | V128: 0 | W128: 0 | X128: 0 | Y128: 0 | Z128: 0 | AA128: 0